fecha,titulo,descripcion,fuente,label_dia,categoria,año
2012-01-05,"Chevron accused of racism as it fights Ecuador pollution ruling:  Oil giant vows to continue fight after appeals court rules it must pay $18bn for dumping toxic waste in Amazon basin
",,DJIA_Top3,0.0,financial,2012
2012-01-05,"EU Agrees to Embargo on Iranian Oil -- European governments have agreed in principle to ban imports of Iranian oil, EU diplomats said Wednesday, dealing a potentially heavy blow to Tehran that crowns new Western economic sanctions imposing real pain just months before an Iranian election.",,DJIA_Top4,0.0,financial,2012
2012-01-05,'Secret' Environment Canada presentation warns of oilsands' impact on habitat,,DJIA_Top12,0.0,financial,2012
2012-01-05,The 27 members of the European Union may be on the brink of announcing an embargo on Iranian oil.,,DJIA_Top10,0.0,financial,2012
2012-01-05,EU moves to ban Iran crude oil,,DJIA_Top25,0.0,financial,2012
2012-01-05,"Chevron accused of racism as it fights Ecuador pollution ruling:  Oil giant vows to continue fight after appeals court rules it must pay $18bn for dumping toxic waste in Amazon basin
",,Reddit,,social_media,2012
2012-01-06,"Iran Mounts New Web Crackdown --- New rules will impose layers of surveillance in the country's popular Internet cafes, as Tehran's political establishment comes under increasing strains from economic turmoil and threats of more international sanctions.",,Reddit,,social_media,2012
2012-01-07,NZ hot air balloon crash: 11 killed,,Reddit,,social_media,2012
2012-01-07,Hot air balloon crash kills 11 in New Zealand,,Reddit,,social_media,2012
2012-01-08,"In Africa, using ants and termites to increase crop yields: Researchers are confirming what African farmers already know: Termites and ants can be used to increase soil fertility and crop yields",,Reddit,,social_media,2012
2012-01-08,Western Oil Firms Remain as US Exits Iraq: The end of the US military occupation does not mean Iraqis have full control of their oil,,Reddit,,social_media,2012
2012-01-10,29 Chinese Fishermen Suing ConocoPhillips &amp; China National Offshore Oil Corp   for $34 million over economic losses following oil leaks in Bohai Bay,,DJIA_Top17,1.0,financial,2012
2012-01-12,Iran's currency in freefall --- Iran's currency has slid 20 percent against the dollar in the last week despite central bank intervention,,DJIA_Top20,1.0,financial,2012
2012-01-12,Children 'dumped in streets by Greek parents who can't afford to look after them any more'.   4-year-old found clutching note: 'I can't afford her'.  Country also running out of medicine.  What is fast becoming the most tragic human consequence of the Euro crisis.,,DJIA_Top7,1.0,financial,2012
2012-01-14,"Unemployment rate 'astronomical', says Spanish PM",,Reddit,,social_media,2012
2012-01-14,China's skyscraper craze 'may herald economic crash',,Reddit,,social_media,2012
2012-01-16,Chevron Corp. says an offshore rig being run for its subsidiary near Nigeria's oil-rich southern delta has caught fire and officials are still trying to account for all the workers there.,,Reddit,,social_media,2012
2012-01-17,"Human Rights Watch states $32 Billion Missing in Oil-rich poverty-stricken Angola; $7.1 billion transferred into escrow accounts overseas and $24.9 billion that appear as ""an unexplained discrepancy in government accounts.""",,DJIA_Top12,1.0,financial,2012
2012-01-17,"The worlds top oil exporter, Saudi Arabia, said on Monday it could increase oil production by about 2 million barrels per day (bpd) almost immediately, a day after Iran threatened its Gulf neighbors not to compensate for any shortfall in its oil exports if sanctions bite too harshly.",,DJIA_Top13,1.0,financial,2012
2012-01-17,China's 'Strong' GDP Report Actually Reveals How Easily The Country Could Go Into A Hard Landing,,DJIA_Top19,1.0,financial,2012
2012-01-18,"Greek rescue blocked by hedge fund greed. Financiers who bought 'distressed' Greek debt insist on making vast profits from the crisis
",,DJIA_Top10,1.0,financial,2012
2012-01-18,"The World Bank says the global economy is on the edge of a new financial crisis, deeper and more damaging than the one that followed the collapse of Lehman Brothers in 2008.

",,DJIA_Top5,1.0,financial,2012
2012-01-18,Currency crisis in Iran as sanctions start to bite,,DJIA_Top13,1.0,financial,2012
2012-01-18,"Greek rescue blocked by hedge fund greed. Financiers who bought 'distressed' Greek debt insist on making vast profits from the crisis
",,Reddit,,social_media,2012
2012-01-18,"The World Bank says the global economy is on the edge of a new financial crisis, deeper and more damaging than the one that followed the collapse of Lehman Brothers in 2008.

",,Reddit,,social_media,2012
2012-01-19,The 10 Fastest-Growing (&amp; Declining) Cities in the World - A new survey from the Brookings Institution ranks the world's 200 largest metropolitan economies -- which account for half of global GDP -- from 1-200,,DJIA_Top10,1.0,financial,2012
2012-01-19,The Bangladesh army says it has foiled a coup planned against the government,,Reddit,,social_media,2012
2012-01-20,"When faced with a non functional printing press, the staff from a Japanese newspaper hand wrote copies to keep reader up to date with vital information during the crisis",,Reddit,,social_media,2012
2012-01-20,Cruise ship's cook says captain ordered dinner after crash,,Reddit,,social_media,2012
2012-01-20,Six Nato soldiers killed in Afghan helicopter crash,,Reddit,,social_media,2012
2012-01-21,Appeals court refused again to block indigenous Ecuadoreans from collecting on an $18.2 billion judgment against Chevron for a massive oil contamination in the Amazon,,Reddit,,social_media,2012
2012-01-21,"Former BP Boss Gets 12m From Iraqi Oil Venture - 

Tony Hayward, who left BP  with a 10m pension pot after the Gulf of Mexico catastrophe,  pockets 1st tranche of payments from Kurdistan oil venture with Genel Energy",,Reddit,,social_media,2012
2012-01-22,Falklanders: We are the luckiest working-class people on earth --  But oil and David Cameron put its sovereignty back on the agenda. ,,Reddit,,social_media,2012
2012-01-22,"Boko Haram, a shadowy Islamist sect that started out as a clerical movement opposed to western education but has become the biggest security menace facing Africa's top oil producer",,Reddit,,social_media,2012
2012-01-23,The Iranian oil embargo: does this mean war?,,DJIA_Top25,0.0,financial,2012
2012-01-23,"Iran vows to close straight after EU bans Iranian oil, ""If any disruption happens regarding the sale of Iranian oil, the Strait of Hormuz will definitely be closed""",,DJIA_Top6,0.0,financial,2012
2012-01-23,"EU imposes Iran oil embargo
",,DJIA_Top13,0.0,financial,2012
2012-01-23,"EU imposes Iran oil embargo
",,Reddit,,social_media,2012
2012-01-24,"More than 50 countries have banned asbestos products but India cannot get enough. It imports the mineral from Canada, risking a future health crisis.
",,Reddit,,social_media,2012
2012-01-24,"More than 50 countries have banned asbestos products but India cannot get enough. It imports the mineral from Canada, risking a future health crisis.
",,DJIA_Top2,0.0,financial,2012
2012-01-26,"Revenge for EU Sanctions:
Iran Set to Turn Off Oil Supply to Europe",,Reddit,,social_media,2012
2012-01-26,"China says EU ban on Iran oil not ""constructive"":  China on Thursday criticized the European Union for banning oil imports from Iran, Beijing's third biggest crude supplier and a major trading partner.",,Reddit,,social_media,2012
2012-01-26,"Revenge for EU Sanctions:
Iran Set to Turn Off Oil Supply to Europe",,DJIA_Top24,0.0,financial,2012
2012-01-27,Spanish Unemployment Rises to 22.9%,,Reddit,,social_media,2012
2012-01-28,"Under EU sanctions, 95% of the world's oil tankers will be banned from carrying Iranian oil.",,Reddit,,social_media,2012
2012-01-29,"Thwarted on US oil pipeline, Canada looks to China",,Reddit,,social_media,2012
2012-01-29,Central banks are printing money to a degree never seen in human history,,Reddit,,social_media,2012
2012-01-30,"India, which imports 12 per cent of its oil from Iran, will not scale down its petroleum imports from Tehran despite US and European sanctions",,DJIA_Top2,0.0,financial,2012
2012-01-31,Unemployment at record high across the eurozone,,DJIA_Top23,0.0,financial,2012
2012-01-31,"Eurozone unemployment hits new record, 10.4%",,DJIA_Top19,0.0,financial,2012
2012-01-31,"""India said...it may use its own currency...to pay for oil imports from Iran in the face of a US-led sanctions campaign aimed at forcing Tehran to abandon its nuclear programme. India has said it will continue to import oil from Iran, joining China in refusing to bow to intensifying US pressure""",,DJIA_Top8,0.0,financial,2012
2012-01-31,"Last shipment of gold bars arrives at Caracas airport, 160 tons repatriated from European and American banks to Venezuela's central bank",,DJIA_Top7,0.0,financial,2012
2012-02-01,Oil now leaking from stricken Carnival cruise ship,,DJIA_Top17,1.0,financial,2012
2012-02-01,"Europe's space industry, cash-strapped as a result of the debt crisis, wants to step up cooperation with China, which has an ambitious program and is building a moon-landing vehicle and capsules for manned missions. Such an alliance would likely cause tensions with the US.",,DJIA_Top13,1.0,financial,2012
2012-02-01,Saudi Oil Minister Calls Global Warming Humanitys Most Pressing Concern,,DJIA_Top6,1.0,financial,2012
2012-02-02,"Ecuador Creating Alternative to Neo-Liberal Model - Ecuador raising taxes on wealthy, higher royalties on oil companies and making large social investments ",,Reddit,,social_media,2012
2012-02-03,"Swiss Question 12 Banks as Libor Probe Widens - Switzerland is investigating European, US, &amp; Japanese banks suspected of conspiring to manipulate interbank lending rates used to set interest rates on hundreds of trillions of dollars of securities",,DJIA_Top22,1.0,financial,2012
2012-02-05,"Call Us Nazis If It Makes You Happy --- 

When Germany asserts its interests, as in the euro crisis, critics invoke its Nazi past. How to react? ""We must not let ourselves be intimidated. A friendly imperviousness, an unoffended rebuff, are the most judicious responses""",,Reddit,,social_media,2012
2012-02-06,"Beijings South China Sea Gamble:  If China is right, then there is enough oil under the South China Sea to feed global consumption for several years. But Beijing may be making an aggressive bet on the wrong horse.
",,DJIA_Top18,0.0,financial,2012
2012-02-06,"Beijings South China Sea Gamble:  If China is right, then there is enough oil under the South China Sea to feed global consumption for several years. But Beijing may be making an aggressive bet on the wrong horse.
",,Reddit,,social_media,2012
2012-02-07,"There is a widespread belief that Germany is the big winner of the euro crisis, as investors stash their money in the euro zone's last safe haven, driving interest rates on German bonds down to record lows. But the idea is just a myth. Indeed, the crisis could end up costing Berlin dearly.",,Reddit,,social_media,2012
2012-02-07,Another European government falls amidst eurocrisis: Romania's government collapsed - the latest European government to give way amid popular resentment toward austerity measures,,Reddit,,social_media,2012
2012-02-07,"Olive glut puts skids under oil producers at risk. A second bumper harvest could see Spanish farmers driven from the land they have worked for generations
",,Reddit,,social_media,2012
2012-02-07,"Olive glut puts skids under oil producers at risk. A second bumper harvest could see Spanish farmers driven from the land they have worked for generations
",,DJIA_Top17,1.0,financial,2012
2012-02-08,Over 2/3 of Irans lawmakers endorse cutting off oil sales to the European Union before EU sanctions on their country go into effect,,Reddit,,social_media,2012
2012-02-12,Murdoch media empire engulfed in scandal as Scotland Yard's net spreads,,Reddit,,social_media,2012
2012-02-12,Photos of Greece in turmoil.,,Reddit,,social_media,2012
2012-02-13,"Athens mayhem raises fears of Greek social explosion. ""We refuse to stand against our parents, our brothers, our children,"" the Greek Police Federation said.",,Reddit,,social_media,2012
2012-02-14,Rome dropped its bid for the 2020 Olympics on Tuesday after Premier Mario Monti said the Italian government would not provide financial backing for an estimated $12.5-billion project at a time of economic crisis.,,Reddit,,social_media,2012
2012-02-14,"The Way Greeks Live Now --- 


A glimpse into harsh reality of life in Greece, where half of all under 25s are now out of work. And yet despite economic turmoil ""somehow everyday life rumbles on, in a collective trance, shot through with gallows humor""",,Reddit,,social_media,2012
2012-02-14,"The Way Greeks Live Now --- 


A glimpse into harsh reality of life in Greece, where half of all under 25s are now out of work. And yet despite economic turmoil ""somehow everyday life rumbles on, in a collective trance, shot through with gallows humor""",,DJIA_Top12,1.0,financial,2012
2012-02-15,Iran Cuts Oil Exports to Europe; Begins Using Its Own Nuclear Fuel,,DJIA_Top4,0.0,financial,2012
2012-02-15,Iran stops oil exports to six EU countries.,,DJIA_Top17,0.0,financial,2012
2012-02-16,"N. Korean helicopter crashes, killing NK Minister of Commerce along with the commercial director of North Pyongan Province and related cabinet officials",,DJIA_Top11,1.0,financial,2012
2012-02-16,"Greece Is on Pace for the Worst Recession in Modern History  The Greek economy shrank nearly 7% in 2011, the fifth straight year the country has been in a recession. GDP has shriveled by a sixth since 2006, and unemployment has tripled over that period to 20%.",,DJIA_Top7,1.0,financial,2012
2012-02-16,Prosecutors Try to Lift German President's Immunity - They've asked the federal parliament to lift President Christian Wulff's immunity over an escalating home loan scandal,,Reddit,,social_media,2012
2012-02-17,"How Chinese Energy Politics Will Reshape the Middle East - 
Chinas going to import a lot more oil from Iran &amp; the Arab world over the next 2 decades. America will import far less. Those 2 facts will profoundly change the geopolitics of the Middle East.


",,Reddit,,social_media,2012
2012-02-17," Japan Slowly Wakes Up to Doomsday Debt Risk -  Capital flight, soaring borrowing costs, tanking currency &amp; stocks &amp; a central bank forced to pump vast amounts of cash into local banks -- that is what Japan may have to contend with if it fails to tackle its snowballing debt",,Reddit,,social_media,2012
2012-02-17,"How Chinese Energy Politics Will Reshape the Middle East - 
Chinas going to import a lot more oil from Iran &amp; the Arab world over the next 2 decades. America will import far less. Those 2 facts will profoundly change the geopolitics of the Middle East.


",,DJIA_Top21,1.0,financial,2012
2012-02-18,"""For Switzerland's largest bank, the hits just keep coming. . . . UBS now appears to be at the center of the financial world's latest scandal: an alleged conspiracy by traders and brokers to rig the price of derivatives around the world by manipulating a key interest rate.""",,Reddit,,social_media,2012
2012-02-18,"Australian bank ANZ rises interest rates, fires 1000 employers and sends excecutives on $1.75m holiday cruise.",,Reddit,,social_media,2012
2012-02-19,Iran stops oil sales to French and British companies,,Reddit,,social_media,2012
2012-02-19,Iran 'halts oil sales to France and Britain',,Reddit,,social_media,2012
2012-02-20,"Europe's finance ministers plan to approve a second bailout for Greece on Monday but Hans-Werner Sinn, the head of Ifo, a top German economic think tank, warns that the money will only help international banks -- not the Greeks. He argues that Greece can only solve its crisis if it quits the euro.",,Reddit,,social_media,2012
2012-02-21,"Canada threatens trade war with EU over tar sands - 
The row over the EU's plan to label tar sands oil as highly polluting escalates as Canada says it 'will not hesitate to defend its interests'",,Reddit,,social_media,2012
2012-02-21,"Oil jumps to 9-month high above $105 in Europe as Iran cuts supply to Britain, France",,Reddit,,social_media,2012
2012-02-21,"Canada threatens trade war with EU over tar sands - 
The row over the EU's plan to label tar sands oil as highly polluting escalates as Canada says it 'will not hesitate to defend its interests'",,DJIA_Top9,1.0,financial,2012
2012-02-23,"Iran talks failure sparks confrontation fears:  The U.N. nuclear watchdog's latest mission to Iran failed to budge a defiant Tehran over its disputed nuclear program, sending oil prices to a nine-month high over fears of an increasing risk of confrontation with the West.",,Reddit,,social_media,2012
2012-02-23,"Giant Argentine train crash kills at least 40, hurts 550 when train plowed into a Buenos Aires platform",,Reddit,,social_media,2012
2012-02-24,Crisis in Syria Looks Very Different on Satellite Channels Owned by Russia and Iran,,Reddit,,social_media,2012
2012-02-24,"European Central Bank President Mario Draghi warned beleaguered euro-zone countries that there is no escape from tough austerity measures and that the Continent's traditional social contract is ""gone"".",,Reddit,,social_media,2012
2012-02-24,"
 
Oil-sands vote ends in deadlock - European Union states fail to agree on whether to recognize oil sands, such as those in Canada, as high polluters",,Reddit,,social_media,2012
2012-02-24,"
 
Oil-sands vote ends in deadlock - European Union states fail to agree on whether to recognize oil sands, such as those in Canada, as high polluters",,DJIA_Top21,0.0,financial,2012
2012-02-26,Rising oil costs strain debt-ridden Europe,,Reddit,,social_media,2012
2012-02-26,Britain leads dash to explore for oil in war-torn Somalia | World news | The Observer,,Reddit,,social_media,2012
2012-02-27,Norways Statoil  has discovered oil 120 miles off the Brazilian coast in the Atlantic Ocean - Statoil is calling the field a high-impact discovery,,DJIA_Top21,0.0,financial,2012
2012-02-29,"Dictators' wives: how the west is wooed by the pretty faces of tyranny. Glamourous lives earn them fawning spreads in magazines like Vogue. But at home they inspire dread, with tales of confiscating people's homes and punishing servants with boiling water.



",,DJIA_Top14,0.0,financial,2012
2012-02-29,"Dictators' wives: how the west is wooed by the pretty faces of tyranny. Glamourous lives earn them fawning spreads in magazines like Vogue. But at home they inspire dread, with tales of confiscating people's homes and punishing servants with boiling water.



",,Reddit,,social_media,2012
2012-03-01,"Iran recently offered to supply Pakistan with tens of thousands barrels of oil per day, a Pakistani official said Thursday. The deal would help ease the country's chronic energy shortages while guaranteeing Tehran a home for some of its crude.",,DJIA_Top17,1.0,financial,2012
2012-03-01,Unemployment in Europe has risen to its highest level since the introduction of the euro.,,DJIA_Top13,1.0,financial,2012
2012-03-03,"Ireland faces long road back to borrowing:  Of all Europes crisis countries, Ireland has been perhaps the most adamant about pushing ahead with the budgetary, banking and other steps urged by its international lenders.",,Reddit,,social_media,2012
2012-03-03,"Venezuela ""does not fear"" sanctions, will continue to supply Syria with oil",,Reddit,,social_media,2012
2012-03-04,"Two trains crash in Poland, many are wounded, some have been killed. (happend two hours ago)",,Reddit,,social_media,2012
2012-03-04,"Libya's instability deepens: detainees tortured, tribal warfare rages, oil-rich region seeks ""autonomy""",,Reddit,,social_media,2012
2012-03-08,Syria's deputy oil minister defects from Assad,,Reddit,,social_media,2012
2012-03-08,Spain's youth unemployment surges above 50%.,,Reddit,,social_media,2012
2012-03-10,Radioactive plutonium spread tens of kilometres from the Fukushima Daiichi nuclear plant. The distances at this material was found implies that plutonium was ejected during the hydrogen explosions in the first days of the crisis.,,Reddit,,social_media,2012
2012-03-10,"'We Need a Bond Between Companies and Workers' - Berthold Huber is leader of Germany's powerful IG Metall union, which represents metal workers. He talks about the rise of worker exploitation in Germany and how unions helped prevent a double-dip recession.",,Reddit,,social_media,2012
2012-03-12,"The 1% Recovery -- While the financial crisis hurt the top 1 percent more than anyone else, their recovery has been spectacular -- while everyone else has languished.",,DJIA_Top20,1.0,financial,2012
2012-03-14,"Switzerland bus crash 'kills 28, including 22 children'",,Reddit,,social_media,2012
2012-03-15,"The Pirate Party, which made international headlines after its success in state elections in Berlin last year, stands to make gains in two other German states this spring. The party's pledge to foster transparency and participation is resonating with voters who are fed up with local corruption. ",,Reddit,,social_media,2012
2012-03-16,"Argentina is intensifying its campaign to block oil development in the Falkland Islands, announcing on Thursday it will pursue ""administrative, civil and criminal"" penalties against the dozens of companies involved.",,Reddit,,social_media,2012
2012-03-16,Shell admits to at least 207 oil spills in 2011,,Reddit,,social_media,2012
2012-03-16,"New Chevron Oil Leak Off Coast of Brazil - Just 5 months after Chevron lost its drilling rights for causing the largest oil spill in recent memory off the coast of Rio de Janeiro, they've gone &amp;  done it again",,Reddit,,social_media,2012
2012-03-16,"Ireland oil strike raises hopes for exploration boom -- Providence Resources boss Tony O'Reilly Junior said: 'I think this discovery also creates a reappraisal in the minds of global oil corporations about coming back to Irish waters to drill for oil'
",,Reddit,,social_media,2012
2012-03-16,"Ireland oil strike raises hopes for exploration boom -- Providence Resources boss Tony O'Reilly Junior said: 'I think this discovery also creates a reappraisal in the minds of global oil corporations about coming back to Irish waters to drill for oil'
",,DJIA_Top21,0.0,financial,2012
2012-03-18,"Brazil : 17 executives from Chevron and Transocean barred from leaving the country, pending criminal charges related to last years Oil Spill.",,Reddit,,social_media,2012
2012-03-18,"Brazil to file charges on Chevron executives:  A federal judge grants a request from prosecutors, barring 17 executives from leaving Brazil, pending criminal charges.",,Reddit,,social_media,2012
2012-03-20,Iran presses ahead with dollar attack (will no longer accept oil payment in USD just as Saddam did in 2000),,Reddit,,social_media,2012
2012-03-21,Apache copter crashes in Afghanistan  Some things just need to be seen to be believed. [video],,Reddit,,social_media,2012
2012-03-22,"Contamination Time Bomb:  Chevron, TransOcean Executives Face Criminal Charge for Brazilian Oil Spill - Prosecutors say 'crime against nature' could land imprudent company's employees in jail",,Reddit,,social_media,2012
2012-03-22,The Brazilian who wants to jail Chevron oilmen,,Reddit,,social_media,2012
2012-03-23,"Not only has the United States reduced oil imports from members of the Organization of the Petroleum Exporting Countries by more than 20 percent in the last three years, it has become a net exporter of refined petroleum products like gasoline for the first time since the Truman presidency.",,DJIA_Top4,1.0,financial,2012
2012-03-25,"Shell Scrambles To Pay Huge Bill For Iran Oil: ""'There are big frustrations with the payment route -- the U.S. pressure is really working,' said a senior oil source. 'It's now nearly impossible to use the banking system.'""",,Reddit,,social_media,2012
2012-03-25,Shell Sued in U.K. Over Massive 2008 Nigerian Oil Spills,,Reddit,,social_media,2012
2012-03-25,"Australia's Federal Dept of Foreign Affairs &amp; Trade emerged as ACTAs cheerleader-in-chief, trumpeting the benefits of the treaty before a rare open federal parliamentary committee",,Reddit,,social_media,2012
2012-03-26,"Kenya announces discovery of oil
",,Reddit,,social_media,2012
2012-03-26,"Kenya announces discovery of oil
",,DJIA_Top11,1.0,financial,2012
2012-03-27,"BP Oil Spill Seriously Harmed Deep-Sea Corals - Evidence ""compelling"" that explosion at Deepwater Horizon drilling rig in 2010 badly damaged colonies in the Gulf of Mexico ",,DJIA_Top10,0.0,financial,2012
2012-03-27,"""People seven miles away can see a gas cloud coming from the Total rig.""  The gas cloud encircled Total's leaking Elgin Franklin oil and gas platform in the North Sea following failed attempts to ""kill"" the leaking well.",,DJIA_Top23,0.0,financial,2012
2012-03-27,"Spanish copyright monopoly lobby Promusicae files lawsuit against reputable Professor Enrique Dans for soiling their honor, and demand 20,000 in damages",,Reddit,,social_media,2012
2012-03-28,"Major changes are needed in agriculture and food consumption around the world if future generations are to be adequately fed, a major report warns.",,Reddit,,social_media,2012
2012-03-28,"Death of a data haven: cypherpunks, WikiLeaks, and the world's smallest nation --- Short history of Sealand, self-proclaimed micro-nation on an old oil-rig in the North Sea. Once a base for pirate broadcasters. Soon, perhaps, a home for Wikileaks?",,Reddit,,social_media,2012
2012-03-28,"Hunt for Skilled Labor: Germany Woos Portugal's Lost Generation  -- The crisis-hit nations of southern Europe have one booming industry left -- their skilled workers are in high demand in Germany, which has a chronic shortage of qualified labor.",,Reddit,,social_media,2012
