fecha,titulo,descripcion,fuente,label_dia,categoria,año
2008-06-08,b'Angst in Ankara: Turkey Steers into a Dangerous Identity Crisis',,Reddit,,social_media,2008
2008-06-08,"b""Oil reserves 'will last decades' - a BBC Scotland investigation has been told""",,Reddit,,social_media,2008
2008-06-09,b'Rising Oil Prices Spark Strikes in Spain and a Saudi Call to Meet',,Reddit,,social_media,2008
2008-06-10,"b'Oil shortage a myth, says industry insider'",,Reddit,,social_media,2008
2008-06-10,b'Corruption in Ukraine allows epidemic to reach crisis point',,Reddit,,social_media,2008
2008-06-11,b'OPEC Supports Saudi-Backed Oil Summit',,Reddit,,social_media,2008
2008-06-12,"b'If U.S. or Israel drops a bomb on Iran, it will shut down Gulf oil exports by launching a barrage of missiles on tankers in the Strait of Hormuz and Arab oil facilities'",,Reddit,,social_media,2008
2008-06-13,"b'Textbooks at a private Islamic school in northern Virginia teach students that it is permissible for Muslims to kill adulterers and converts from Islam, according to a federal investigation '",,Reddit,,social_media,2008
2008-06-14,b'Popularity of palm oil pushing orangutans towards extinction? Producers resist movement to force food manufacturers to list palm oil on product labels',,Reddit,,social_media,2008
2008-06-15,"b""Saudi Arabia's oil minister on Sunday will address reports that the world's largest oil-producing country is set to raise production by about 500,000 barrels per day.""",,Reddit,,social_media,2008
2008-06-16,"b'We are very happy with the food crisis. Why? Because we produce a lot of food, and our problem has been the market. (WTF?)'",,Reddit,,social_media,2008
2008-06-17,b'Ahmadinejad to OPEC: Dump weak dollar',,Reddit,,social_media,2008
2008-06-18,"b'The son of former UK PM Margaret Thatcher help organize an attempted coup in Equatorial Guinea. The plot was approved by the CIA, big oil, South Africa and Spain. '",,Reddit,,social_media,2008
2008-06-19,"b'Four oil giants to return to Iraq: Exxon Mobil, Shell, Total and BP'",,Reddit,,social_media,2008
2008-06-19,"b""Nigerian rebels attack deepwater oil facility, stopping 10% of Nigeria's oil output. They also capture US Capt. Jack Stone of a Tidex oil ship. """,,Reddit,,social_media,2008
2008-06-19,b'Mexico freezes prices on 150 food items becouse of rising inflation and civil discontent',,Reddit,,social_media,2008
2008-06-20,b'Chavez threatens to stop oil exports to Europe over treatment of immigrants',,Reddit,,social_media,2008
2008-06-21,b'Venezuela Threatens to Cease Oil Sales to EU',,Reddit,,social_media,2008
2008-06-21,b'Nigerian rebels ask foreign workers to leave oil installations',,Reddit,,social_media,2008
2008-06-21,"b""Militias Rule Nigeria's Oil Output; President Yar'Adua Speculates on Nuclear Energy""",,Reddit,,social_media,2008
2008-06-22,"b'The ugly truth behind the Iraq and Afghanistan wars finally has emerged:  These Wars Are About Oil, Not Democracy'",,Reddit,,social_media,2008
2008-06-22,b'Attacks in Nigeria force oil companies to suspend production',,Reddit,,social_media,2008
2008-06-23,b'Federal Air Marshals Face Criminal Charges',,Reddit,,social_media,2008
2008-06-26,b'Exxon WINS...a lesson to American Oil Consumers...our demand causes this!',,Reddit,,social_media,2008
2008-06-27,b'Echoes of Great Depression as Dow takes another dive. OPEC says that oil could hit $170 a barrel over the summer. ',,Reddit,,social_media,2008
2008-06-27,"b'Lebanon: ""No food, no water, no sleep, no toilet, until we signed a confession. They used electrical torture, water torture and they tied our hands behind our backs and lifted us.""'",,Reddit,,social_media,2008
2008-06-27,b'Oil tops $140 a barrel',,Reddit,,social_media,2008
2008-06-27,"b""Zimbabweans refuse to vote and spoil ballot papers, despite Robert Mugabe's violent threats.""",,Reddit,,social_media,2008
2008-06-28,b'Bush is trying to impose a classic colonial status on Iraq. US efforts to force Iraqis to swallow permanent vassal status and give up control of their oil echoes British imperial history',,Reddit,,social_media,2008
2008-06-28,"b'OPEC: ""There is more than enough oil in the market to meet the international demand"", devaluation of Dollar is the problem, and prepare to ""$170 a barrel before the end of the year""'",,Reddit,,social_media,2008
2008-06-28,"b""Dad of Serb goon's punk pal brags feds will never nab jock for brutal beatdown""",,Reddit,,social_media,2008
2008-06-28,b'Envisioning a world of $200-a-barrel oil: LATIMES',,Reddit,,social_media,2008
2008-06-28,b'As more people grow their own produce in response to the credit crisis the food in their gardens is being stolen.',,Reddit,,social_media,2008
2008-06-29,b'Rural British gangs move into the oil business. Tankers tailed by petrol thieves.',,Reddit,,social_media,2008
2008-06-29,"b'US special forces raided a Shite town on Friday killing a relative of Iraqi PM Maliki, the resulting diplomatic crisis is growing.'",,Reddit,,social_media,2008
2008-06-29,b'How the global food crisis was created',,Reddit,,social_media,2008
2008-06-30,b'Not a Surprise: U.S. Advisors to the Iraqi Oil Minitry played an integratal part in the new oil contracts about to be awarded to Western companies.',,Reddit,,social_media,2008
2008-06-30,b'Oil prices pass $143 a barrel; US gas hits high',,Reddit,,social_media,2008
2008-07-01,"b' Iraq fails to sign contracts with global oil majors because oil companies refused to offer consultancy based on fees, as they wanted a share of the oil'",,Reddit,,social_media,2008
2008-07-01,b'IMF to investigate the US Federal reserve?',,Reddit,,social_media,2008
2008-07-01,b'Iraqis say NO to profit sharing with big oil',,Reddit,,social_media,2008
2008-07-01,b'Polish president throws the EU into new crisis as he declares: The Lisbon treaty is pointless',,Reddit,,social_media,2008
2008-07-04,b'Biofuels are prime cause of food crisis - leaked World Bank report',,Reddit,,social_media,2008
2008-07-04,"b""Naomi Klein: Big Oil's Iraq deals are the greatest stick-up in history""",,Reddit,,social_media,2008
2008-07-04,"b'Iraq is being forced to give foreign firms 75% of the value of their oil leaving just 25% for the Iraqis. How were they forced to do this? By torture, suffering and death. '",,Reddit,,social_media,2008
2008-07-04,"b'From the ""No Shit"" file: World must brace for oil beyond $150 '",,Reddit,,social_media,2008
2008-07-05,b'U.S. Deserters Could Qualify as Refugees in Canada Rules Federal Court',,Reddit,,social_media,2008
2008-07-05,b' World must brace for oil beyond $150',,Reddit,,social_media,2008
2008-07-05,b'Colombia foils bomb plot after rescue ',,Reddit,,social_media,2008
2008-07-06,"b""Before the G-8 Summit: Merkel Warns Food Crisis Could 'Destabilize Nations'""",,Reddit,,social_media,2008
2008-07-07,b'Myths of the Cuban Missile Crisis',,Reddit,,social_media,2008
2008-07-07,"b""Don't envy us, Saudis say, as inflation leaves them feeling poorer despite huge oil boom""",,Reddit,,social_media,2008
2008-07-07,b'Oil price shock means China is at risk of blowing up',,Reddit,,social_media,2008
2008-07-08,"b""Where's All the World's Food? Its the worst crisis of its kind in more than 30 years.""",,Reddit,,social_media,2008
2008-07-08,b'Researchers demonstrate that oil prices are due to speculators and not suppy/demand',,Reddit,,social_media,2008
2008-07-09,"b""Iran blames West for 'artificially' raising oil prices, says war threat is a 'joke'""",,Reddit,,social_media,2008
2008-07-12,b'Czechs See Oil Flow Fall and Suspect Russian Ire on Missile System',,Reddit,,social_media,2008
2008-07-14,b'Federal Judge Ruling: George W. Bush is a Felon',,Reddit,,social_media,2008
2008-07-14,"b""Venezuela's Chavez says oil could reach $300""",,Reddit,,social_media,2008
2008-07-14,b'This recession could easily tip into a depression. Remembering the 30s and salaries of 1.50 a week.',,Reddit,,social_media,2008
2008-07-14,"b'""The best thing that could happen to the country is if no oil is found""'",,Reddit,,social_media,2008
2008-07-15,b'Overpopulation and Oil: What the Talking Heads Dont Talk About',,Reddit,,social_media,2008
2008-07-16,b' Oil prices continue to fall',,Reddit,,social_media,2008
2008-07-17,"b' European recession looms as Spain crumbles. ""Spain is now spiralling into the worst crisis since the Franco dictatorship. ""The economy is in dire straits.""'",,Reddit,,social_media,2008
2008-07-17,b'SLIDING INTO RECESSION~Economic Tempest Overtakes Europe',,Reddit,,social_media,2008
2008-07-18,b'Avoid Public Toilets! An Olympic Visitors Guide to China',,Reddit,,social_media,2008
2008-07-20,b'New Hampshire To Accept Free Oil From Venezuela',,Reddit,,social_media,2008
2008-07-22,"b""Inflation 'to hit Asian growth'""",,Reddit,,social_media,2008
2008-07-24,"b'oil market investigation, regulators bring lawsuit against dutch firm for ""19 separate attempts at market manipulation in March 2007""'",,Reddit,,social_media,2008
2008-07-25,b'Oil Prices Bring Sailing Back: The first commercial cargo of French wine to be transported by sailboat in the modern era is due to arrive in Dublin this week',,Reddit,,social_media,2008
2008-07-26,b'Mexicos leaders to allow its oil to be stolen. Go Neocons. Calderon insists that his reforms are necessary for the very survival of the country. So it doesnt end up like Iraq?',,Reddit,,social_media,2008
2008-07-27,b'Inmates sleep in toilets at overcrowded prison',,Reddit,,social_media,2008
2008-07-27,b'Global Forces Converge To Drive Up Oil Prices',,Reddit,,social_media,2008
2008-07-27,b'Let Them Eat Free Markets -   How deregulation fuels the global food crisis.',,Reddit,,social_media,2008
2008-07-29,b'How the illegal cigarette trade fed the Yugoslav wars',,Reddit,,social_media,2008
2008-07-29,b'Grim News From IMF: No End In Sights On Credit Crisis.',,Reddit,,social_media,2008
2008-07-30,b'Zimbabwe to introduce new currency in order to combat hyperinflation',,Reddit,,social_media,2008
2008-08-02,b'Covert CIA Detention Center on British Soil Revealed',,Reddit,,social_media,2008
2008-08-03,b'Leaky toilet exposes corrupt China official',,Reddit,,social_media,2008
2008-08-03,"b'""when people are chewing qat, they don\'t ask awkward questions about where Yemen\'s oil revenues are going."" '",,Reddit,,social_media,2008
2008-08-03,"b'Maverick oil analyst Ed Morse predicts oil prices will keep tumbling, and would not be surprised if prices dip below $100 in Nov'",,Reddit,,social_media,2008
2008-08-05,b'Iran threatens to close Persian Gulf to oil tankers ',,Reddit,,social_media,2008
2008-08-05,"b'Sex for food: Rising food prices around the world are likely to drive poor women to trade sex for basic goods like fish and cooking oil, raising the risk of new AIDS infections.'",,Reddit,,social_media,2008
2008-08-06,"b'Malaysia, Indonesia Will Pump Out 40% More Palm Oil Biodiesel'",,Reddit,,social_media,2008
2008-08-08,b'Caucasus in crisis: Georgia invades South Ossetia',,Reddit,,social_media,2008
2008-08-08,Caucasus in crisis: Georgia invades South Ossetia,,DJIA_Top22,0.0,financial,2008
2008-08-09,"b""Georgia's oil pipeline is key to U.S. support""",,Reddit,,social_media,2008
2008-08-09,b'Russia v. Georgia: The Oil &amp; Gas Implications - Georgia just so happens to be channeling 1m barrels/day of Caspian oil for the West through its territory',,Reddit,,social_media,2008
2008-08-09,b'Freak Czech Train Crash Kills Seven After Hitting Collapsed Bridge',,Reddit,,social_media,2008
2008-08-11, Russia has just beaten the United States over the head with Peak Oil,,DJIA_Top22,1.0,financial,2008
2008-08-11,b' Russia has just beaten the United States over the head with Peak Oil',,Reddit,,social_media,2008
2008-08-14,b'Bank analyst forecast Georgian crisis 2 days early',,Reddit,,social_media,2008
2008-08-14,b'Nigeria has handed over the potentially oil-rich Bakassi peninsula to Cameroon.',,Reddit,,social_media,2008
2008-08-14,Bank analyst forecast Georgian crisis 2 days early,,DJIA_Top16,1.0,financial,2008
2008-08-14,Nigeria has handed over the potentially oil-rich Bakassi peninsula to Cameroon.,,DJIA_Top13,1.0,financial,2008
2008-08-15,"b""Business Week: Victory in Georgia gives Russia the edge in the struggle over access to the Caspian's 35 billion barrels of oil and trillions of cubic feet of gas""",,Reddit,,social_media,2008
2008-08-15,b'Georgia is all about the oil pipelines',,Reddit,,social_media,2008
2008-08-15,Georgia is all about the oil pipelines,,DJIA_Top24,1.0,financial,2008
2008-08-15,Business Week: Victory in Georgia gives Russia the edge in the struggle over access to the Caspian's 35 billion barrels of oil and trillions of cubic feet of gas,,DJIA_Top11,1.0,financial,2008
2008-08-17,"b'Georgia, Israel, the CIA, the US and Russia. Its all about the oil. '",,Reddit,,social_media,2008
2008-08-17,b'OPEC official says output cuts may be needed',,Reddit,,social_media,2008
2008-08-18,"b'Georgian Situation Continues the Quest for The Prize of Oil, Money and Power'",,Reddit,,social_media,2008
2008-08-18,"Georgian Situation Continues the Quest for The Prize of Oil, Money and Power",,DJIA_Top15,0.0,financial,2008
2008-08-19,Brazil Will Play Military War Game to Defend Recently Discovered Offshore Oil,,DJIA_Top16,0.0,financial,2008
2008-08-19,b'Brazil Will Play Military War Game to Defend Recently Discovered Offshore Oil',,Reddit,,social_media,2008
2008-08-20,150 Feared Dead In Spanair Plane Crash In Madrid ,,DJIA_Top13,1.0,financial,2008
2008-08-20,b'150 Feared Dead In Spanair Plane Crash In Madrid ',,Reddit,,social_media,2008
2008-08-21,"Kazakhstan is considering diverting its oil exports away from the BTC pipeline that runs through Georgia, and using Russia instead. The reason?",,DJIA_Top12,1.0,financial,2008
2008-08-21,"b'Kazakhstan is considering diverting its oil exports away from the BTC pipeline that runs through Georgia, and using Russia instead. The reason?'",,Reddit,,social_media,2008
2008-08-22,Syria says its ready to put a Russian missile system on its soil as a counterweight to U.S. plans to deploy a missile shield in Poland and the Czech Republic,,DJIA_Top1,1.0,financial,2008
2008-08-22,b'Syria says its ready to put a Russian missile system on its soil as a counterweight to U.S. plans to deploy a missile shield in Poland and the Czech Republic',,Reddit,,social_media,2008
2008-08-23,b' Long wait for Spain crash answers',,Reddit,,social_media,2008
2008-08-24,b'Boeing 737 Passenger jet crashes in Kyrgyzstan',,Reddit,,social_media,2008
2008-08-30,b'South Ossetia says it will join North Ossetia-Alania as a federal subject of Russia',,Reddit,,social_media,2008
2008-08-30,b'Unemployment and poverty on the rise in Berlin',,Reddit,,social_media,2008
2008-08-30,b'Azerbaijan to transport some oil through Iran instead of Georgia: one example of how Iran benefits slightly from the war',,Reddit,,social_media,2008
2008-08-31,"b""Iraq has signed its first major oil deal since the fall of Saddam Hussein's regime. $3 billion oil deal with......................................................China. """,,Reddit,,social_media,2008
2008-08-31,"b'""Iraq has signed its first major oil deal with a foreign company"" What? What happened with Exxon Mobil, Shell, Total, and Chevron?'",,Reddit,,social_media,2008
2008-09-03,Oil prices likely to drop below $100 due to falling demand and stronger dollar - according to Reuters,,DJIA_Top8,1.0,financial,2008
2008-09-03,"As Brazil begins to tap its immense oil reserves, it is bucking the tradition of giving all the profits to the upper-class.",,DJIA_Top3,1.0,financial,2008
2008-09-03,"b'As Brazil begins to tap its immense oil reserves, it is bucking the tradition of giving all the profits to the upper-class.'",,Reddit,,social_media,2008
2008-09-03,b'Oil prices likely to drop below $100 due to falling demand and stronger dollar - according to Reuters',,Reddit,,social_media,2008
2008-09-04,"b""Pakistan reacts with fury after up to 20 die in 'American' attack on its soil""",,Reddit,,social_media,2008
2008-09-04,Pakistan reacts with fury after up to 20 die in 'American' attack on its soil,,DJIA_Top18,0.0,financial,2008
2008-09-06,b'Polish intelligence confirms secret CIA prison facility on Polish soil - BBC',,Reddit,,social_media,2008
2008-09-06,"b'China\'s central bank has been on a buying binge in the United States over the last seven years - ""It is as if China has made a gift to the United States Navy of 200 brand new aircraft carriers.""'",,Reddit,,social_media,2008
2008-09-07,b'Pakistan Condemns U.S. Attack on Its Soil',,Reddit,,social_media,2008
2008-09-10,"Iran Being Supported by Shell Oil, OMV and Many Others",,DJIA_Top16,1.0,financial,2008
2008-09-10,"b'Iran Being Supported by Shell Oil, OMV and Many Others'",,Reddit,,social_media,2008
2008-09-12,b'Venezuela has thrown out US ambassador and threatened to cut off oil supplies to US',,Reddit,,social_media,2008
2008-09-12,OPEC finished??  Saudi Arabia says 'LATER!',,DJIA_Top1,0.0,financial,2008
2008-09-12,Venezuela has thrown out US ambassador and threatened to cut off oil supplies to US,,DJIA_Top19,0.0,financial,2008
2008-09-12,"b""OPEC finished??  Saudi Arabia says 'LATER!'""",,Reddit,,social_media,2008
2008-09-14,b'Plane Crashes in Russia with 87 on Board',,Reddit,,social_media,2008
2008-09-15,b'Nigeria militants warn of oil war ',,Reddit,,social_media,2008
2008-09-15,Nigeria militants warn of oil war ,,DJIA_Top15,0.0,financial,2008
2008-09-16,"b'Aquaflow Strikes Oil with ""Green Crude"" from Algae'",,Reddit,,social_media,2008
2008-09-16,"b""Nigeria militants 'raze' Shell oil complex """,,Reddit,,social_media,2008
2008-09-16,"Aquaflow Strikes Oil with ""Green Crude"" from Algae",,DJIA_Top5,1.0,financial,2008
2008-09-16,Nigeria militants 'raze' Shell oil complex ,,DJIA_Top15,1.0,financial,2008
2008-09-19,China Blames Wall Street Meltdown On Federal Reserve Overissuance Of Currency ,,DJIA_Top8,1.0,financial,2008
2008-09-19,"b""Swaziland's HIV/AIDS treatment crisis goes critical""",,Reddit,,social_media,2008
2008-09-19,Swaziland's HIV/AIDS treatment crisis goes critical,,DJIA_Top25,1.0,financial,2008
2008-09-19,b'China Blames Wall Street Meltdown On Federal Reserve Overissuance Of Currency ',,Reddit,,social_media,2008
2008-09-21,b'UK Police Federation set to demand right to strike',,Reddit,,social_media,2008
2008-09-22,b'Oil prices shoot up over $25 a barrel - the biggest 1-day rise ever - as anxiety over US bailout weighs on dollar ',,Reddit,,social_media,2008
2008-09-22,Oil prices shoot up over $25 a barrel - the biggest 1-day rise ever - as anxiety over US bailout weighs on dollar ,,DJIA_Top2,0.0,financial,2008
2008-09-23,Sarkozy calls for those behind the market crisis to be punished,,DJIA_Top16,0.0,financial,2008
2008-09-23, U.S.-led wars behind Wall Street crisis: Ahmadinejad,,DJIA_Top20,0.0,financial,2008
2008-09-23,Irans President Mahmoud Ahmadinejad says the US military intervention abroad is partly to blame for the economic turmoil on Wall Street.,,DJIA_Top15,0.0,financial,2008
2008-09-23,Iran president blames Wall Street turmoil on U.S. 'military engagement',,DJIA_Top14,0.0,financial,2008
2008-09-23,b'Irans President Mahmoud Ahmadinejad says the US military intervention abroad is partly to blame for the economic turmoil on Wall Street.',,Reddit,,social_media,2008
2008-09-23,b'Sarkozy calls for those behind the market crisis to be punished',,Reddit,,social_media,2008
2008-09-23,b' U.S.-led wars behind Wall Street crisis: Ahmadinejad',,Reddit,,social_media,2008
2008-09-23,"b""Iran president blames Wall Street turmoil on U.S. 'military engagement'""",,Reddit,,social_media,2008
2008-09-25,"Stopping a Financial Crisis, the Swedish Way",,DJIA_Top4,1.0,financial,2008
2008-09-25,"b'A McCain-Palin ad claims Obama has been ""mum"" on the economic crisis. That\'s false.'",,Reddit,,social_media,2008
2008-09-25,"b'Stopping a Financial Crisis, the Swedish Way'",,Reddit,,social_media,2008
2008-09-25,"A McCain-Palin ad claims Obama has been ""mum"" on the economic crisis. That\'s false.",,DJIA_Top20,1.0,financial,2008
2008-09-27,b'Venezuela and China Sign a New Oil Deal',,Reddit,,social_media,2008
2008-09-27,"b""Zimbabwe's food crisis is escalating""",,Reddit,,social_media,2008
2008-09-28,"b""China's Tainted-Milk Crisis Grows Despite Official Claims """,,Reddit,,social_media,2008
2008-09-28,b'Chavez says crisis-hit U.S. needs new constitution',,Reddit,,social_media,2008
2008-09-29,"b""Japan makes cars. Saudi Arabia pumps oil. China supplies socks and flat-screen TVs. What's America's No.1 export? Debt""",,Reddit,,social_media,2008
2008-09-29,Japan makes cars. Saudi Arabia pumps oil. China supplies socks and flat-screen TVs. What's America's No.1 export? Debt,,DJIA_Top2,0.0,financial,2008
2008-10-01,"b'""In Bolivia, we nationalized for the people to have money, while the United States wants to nationalize debt and a crisis of the wealthy.""'",,Reddit,,social_media,2008
2008-10-01,b'Cost of massive unemployment in Iraq could be paid in blood',,Reddit,,social_media,2008
2008-10-01,Cost of massive unemployment in Iraq could be paid in blood,,DJIA_Top16,0.0,financial,2008
2008-10-01,"""In Bolivia, we nationalized for the people to have money, while the United States wants to nationalize debt and a crisis of the wealthy.""",,DJIA_Top10,0.0,financial,2008
2008-10-02,"b'Alternative to German bank crisis: The transformation of the banks into public utilities, their democratic control by the people, and their subordination to the interests of society as a whole.'",,Reddit,,social_media,2008
2008-10-02,"b'Life in Zimbabwe... "" a teachers monthly pay was not even enough to buy two bottles of cooking oil.""'",,Reddit,,social_media,2008
2008-10-02,"Alternative to German bank crisis: The transformation of the banks into public utilities, their democratic control by the people, and their subordination to the interests of society as a whole.",,DJIA_Top8,0.0,financial,2008
2008-10-02,"Life in Zimbabwe... "" a teachers monthly pay was not even enough to buy two bottles of cooking oil.""",,DJIA_Top24,0.0,financial,2008
2008-10-03,"b""Medvedev : The U.S. financial crisis should be taken as a sign that America's global economic leadership is on the wane""",,Reddit,,social_media,2008
2008-10-03,"b""Development Doesn't Require Big Government~Poor countries are learning the wrong lessons from the crisis.""",,Reddit,,social_media,2008
2008-10-03,Development Doesn't Require Big Government~Poor countries are learning the wrong lessons from the crisis.,,DJIA_Top24,0.0,financial,2008
2008-10-03,Medvedev : The U.S. financial crisis should be taken as a sign that America's global economic leadership is on the wane,,DJIA_Top4,0.0,financial,2008
2008-10-04,b'EU heads hold bank crisis talks',,Reddit,,social_media,2008
2008-10-05,b'Two High-Ranking McCain Campaign Officials Lobbied For Companies At Center of Sex-For-Oil Scandal',,Reddit,,social_media,2008
2008-10-05,b'Crisis talks to save German bank',,Reddit,,social_media,2008
2008-10-08,b'A bunch of multinationals have figured out how to make their pollution-based businesses seem like the solution to the climate crisis.',,Reddit,,social_media,2008
2008-10-08,"World economic crisis deepens: Nikkei sinks 9%, Russian exchange was shut down after a huge decline at the open, U.K. bailing out banks",,DJIA_Top13,0.0,financial,2008
2008-10-08,A bunch of multinationals have figured out how to make their pollution-based businesses seem like the solution to the climate crisis.,,DJIA_Top25,0.0,financial,2008
2008-10-08,"b'World economic crisis deepens: Nikkei sinks 9%, Russian exchange was shut down after a huge decline at the open, U.K. bailing out banks'",,Reddit,,social_media,2008
2008-10-09,IMF: World on Brink of Recession,,DJIA_Top25,0.0,financial,2008
2008-10-09,U.S. report warns of crisis in Afghanistan,,DJIA_Top21,0.0,financial,2008
2008-10-09,b'U.S. report warns of crisis in Afghanistan',,Reddit,,social_media,2008
2008-10-09,b'IMF: World on Brink of Recession',,Reddit,,social_media,2008
2008-10-10,Nature loss 'dwarfs bank crisis',,DJIA_Top12,0.0,financial,2008
2008-10-10,"b""Nature loss 'dwarfs bank crisis'""",,Reddit,,social_media,2008
2008-10-10,b'Oh My! Whatever Will The Oil Barons &amp; Ministers Do? We need a rally for OPEC!!',,Reddit,,social_media,2008
2008-10-10,"b'Meanwhile, shares on the Tehran stock exchange have increased in value by 20% during the year.  (Of course, the majority of their eggs are in the oil basket....)'",,Reddit,,social_media,2008
2008-10-10,Oh My! Whatever Will The Oil Barons &amp; Ministers Do? We need a rally for OPEC!!,,DJIA_Top17,0.0,financial,2008
2008-10-10,"Meanwhile, shares on the Tehran stock exchange have increased in value by 20% during the year.  (Of course, the majority of their eggs are in the oil basket....)",,DJIA_Top18,0.0,financial,2008
2008-10-10,Pakistan in crisis on mission for US funding,,DJIA_Top25,0.0,financial,2008
2008-10-10,b'Pakistan in crisis on mission for US funding',,Reddit,,social_media,2008
2008-10-11,b'World Leaders to Act in Concert to Stem Financial Crisis  News Coverage',,Reddit,,social_media,2008
2008-10-11,b'World financial crisis leads to auto industry layoffs across Europe',,Reddit,,social_media,2008
2008-10-12,b'Financial crisis: Countries at risk of bankruptcy from Pakistan to Baltics ',,Reddit,,social_media,2008
2008-10-13,"b'AskReddit: Out of all the significant world events that you have experienced in your lifetime, where would you rank the current financial crisis ? '",,Reddit,,social_media,2008
2008-10-13,b'Fighting the Financial Crisis: Stocks Surge As EU Nations Unveil Bailout Packages',,Reddit,,social_media,2008
2008-10-13,Fighting the Financial Crisis: Stocks Surge As EU Nations Unveil Bailout Packages,,DJIA_Top24,1.0,financial,2008
2008-10-13,"AskReddit: Out of all the significant world events that you have experienced in your lifetime, where would you rank the current financial crisis ? ",,DJIA_Top17,1.0,financial,2008
