fecha,titulo,descripcion,fuente,label_dia,categoria,año
2014-01-28,"Spain's prime minister is trying to ban abortion despite almost no support from the people - In the midst of a jobs crisis and economic dysfunction, Spain now must face a bitter debate over government plans to radically restrict womens rights.",,Reddit,,social_media,2014
2014-01-29,Americas health craze for fish oil is wiping out the worlds rarest shark,,Reddit,,social_media,2014
2014-02-04,"Pope: unjust unemployment can mean sin, suicide ""He noted that sometimes 'unjust social conditions' like unemployment lead to this type of destitution by depriving people of the dignity of work and access to education and health care.""",,DJIA_Top4,1.0,financial,2014
2014-02-04,"Oilsands air pollutants underestimated, researchers find",,DJIA_Top11,1.0,financial,2014
2014-02-05,Three bankers go on trial in Dublin over financial crash that brought Ireland to its knees,,DJIA_Top15,0.0,financial,2014
2014-02-05,"Alberta pipeline ruptured in 2009, TransCanada and federal regulators hid report until a FOIA request by CBC",,DJIA_Top20,0.0,financial,2014
2014-02-06,"Fuck the EU, frustrated US Assistant Secretary of State says to US Ambassador to Ukraine in a leaked phone call about inaction and indecision by the European Union in solving Ukraines political crisis.",,Reddit,,social_media,2014
2014-02-09,"Under the new ""Fair Elections Act"" Canadian Chief Electoral Officer (independent officer in charge of administering federal elections) says Conservative Government will remove his ability to promote and speak about democracy in Canada. Conservatives also invoked debate time limit.",,Reddit,,social_media,2014
2014-02-10,"China spending more than Europe on science and technology as GDP percentage, new figures reveal",,Reddit,,social_media,2014
2014-02-10,"A confidential email shows a top Chinese regulator directly asked JP Morgan's chief executive, for a""favor"" to hire a job applicant - Federal authorities are now investigating whether the hiring at JPMorgan was done explicitly to win business from Chinese companies",,DJIA_Top12,1.0,financial,2014
2014-02-11,Algeria plane crash 'kills 103',,DJIA_Top21,1.0,financial,2014
2014-02-13,EU tells Britain to include Prostitutes And Drug Dealers in GDP,,Reddit,,social_media,2014
2014-02-14,"""No banks should be promised eternal life"" - Norwegian governor of the Norwegian federal reserve says.",,DJIA_Top6,1.0,financial,2014
2014-02-16,Germany draws up plans against NSA to counter American spies on its soil,,Reddit,,social_media,2014
2014-02-17,"Dolphins 'suffering miscarriage, lung disease, losing teeth after BP oil spill' researchers claim",,Reddit,,social_media,2014
2014-02-18,News Corps $882m blew the Australian budget: 'The single largest factor in the underlying deterioration of the federal budget announced by Treasurer Joe Hockey in December was a cash payout of almost $900 million to Rupert Murdochs News Corp',,Reddit,,social_media,2014
2014-02-20,Nigeria's central bank governor Lamido Sanusi has been suspended after he alleged that $20bn (12bn) in oil revenue had gone missing.,,Reddit,,social_media,2014
2014-02-21,"Venezuela's poor join protests as turmoil grips Chvez's revolution - ""This country can't stay like this for much longer. If it's not lack of food, it is the fear of being killed when you step out of your house to go to work"", Jorge Farias said. ""I would like to wake up without this fear,""",,Reddit,,social_media,2014
2014-02-22,Ukraine's president says he won't resign and likens country's political crisis to Nazis' rise.,,Reddit,,social_media,2014
2014-02-24,"Venezuelas central bank said yesterday that the scarcity index reached 28 percent in January, the highest since the central bank created the measure in 2005, meaning that more than one in four basic goods was out of stock at any given time.",,DJIA_Top8,1.0,financial,2014
2014-02-25,Australian Federal Election Fraud. Police investigate multiple votes in 2013 federal election; one person voted 15 times.,,DJIA_Top25,0.0,financial,2014
2014-03-01,Ukraine crisis live: Russia admits its troops are moving in Crimea,,Reddit,,social_media,2014
2014-03-01,U.N. Security Council to hold emergency meeting on Ukraine crisis,,Reddit,,social_media,2014
2014-03-02,Pope Francis is urging world leaders to promote dialogue as a way of resolving the crisis in Ukraine.,,Reddit,,social_media,2014
2014-03-04,"""Chancellor Angela Merkel of Germany told Mr. Obama by telephone on Sunday that after speaking with Mr. Putin she was not sure he was in touch with reality, people briefed on the call said. In another world, she said.""",,Reddit,,social_media,2014
2014-03-04,"French scientists revive 30,000-year-old virus, say it ""serves as a warning that unknown pathogens entombed in frozen soil may be roused by global warming""",,Reddit,,social_media,2014
2014-03-04,"Moscow intends to discuss the Ukraine crisis with the West on two key conditions. The source says the 21 February agreement - signed by ousted President Yanukovych and the Ukrainian opposition - must be implemented, and that all Ukrainian political forces must take part in negotiations.",,Reddit,,social_media,2014
2014-03-04,"Ukraine crisis: Russia stands firm despite rebukes, sanctions threats",,Reddit,,social_media,2014
2014-03-05,Vancouver Police Department to feds: We wont enforce new pot law,,DJIA_Top5,0.0,financial,2014
2014-03-05,"Russia has revealed it sold a record $11.3bn in foreign currency to support the rouble on March 3, during a ""Black on Monday"" of panic selling over the crisis in Ukraine | The Russian central bank sold foreign currency to buy roubles and prevent the Russian currency from falling further in value.",,DJIA_Top16,0.0,financial,2014
2014-03-05,Ukraine crisis: Ukrainians rush to join military - Ukraine has called up its reserves even though Russian invasion has so far been bloodless,,DJIA_Top20,0.0,financial,2014
2014-03-06,U.S. imposes new sanctions on Russian officials it blames for Ukraine crisis,,DJIA_Top13,1.0,financial,2014
2014-03-06,Russian Federation Council Considering Bill to Confiscate US and European Company Assets in Russia in Case of Sanctions,,DJIA_Top15,1.0,financial,2014
2014-03-06,"Tim Flannery says coal communities are being kept in dark about dangers. Our government is doing an inquiry into the health impact of wind [turbines], but here weve got this risk with coal. If the federal government expanded their inquiry that would be good start, he said.",,DJIA_Top21,1.0,financial,2014
2014-03-06,Obama Signs Order Declaring Ukraine Crisis an Extraordinary Threat to National Security,,DJIA_Top2,1.0,financial,2014
2014-03-07,Ukraine crisis: US sends F-16 fighter jets to Poland,,DJIA_Top19,1.0,financial,2014
2014-03-07,"Amid Crimea Crisis, Russia Proposes Expanding Citizenship in Ex-USSR - The Russian government has proposed legislation that would grant citizenship to anyone who speaks fluent Russian and had once lived, or who had relatives who lived, on the territory of the Soviet Union [x-post /r/LegalNews]",,DJIA_Top8,1.0,financial,2014
2014-03-08,Vitnamese Navy confirms plane crashes into the sea.,,Reddit,,social_media,2014
2014-03-08,Oil Slick Sighting Is First Sign Malaysia Airlines Plane May Have Crashed,,Reddit,,social_media,2014
2014-03-08,Ukraine crisis 'created artificially' - Russia's Lavrov,,Reddit,,social_media,2014
2014-03-09,Japanese PM Abe to tell Putin of Japan's trilateral stance with U.S. and EU on Ukraine crisis,,Reddit,,social_media,2014
2014-03-09,"Libya threatens N Korea ship over seized oil - Libya has threatened to bomb a North Korean-flagged tanker if it tries to export oil from a rebel-controlled port east of Tripoli, in a major escalation of a standoff over the country's petroleum wealth.",,Reddit,,social_media,2014
2014-03-10,"Ukraine crisis: US will not recognise Crimea referendum, says ambassador: Washington threatens further action against Russia if Vladimir Putin uses poll to legitimise military occupation, says Kiev envoy",,DJIA_Top5,0.0,financial,2014
2014-03-12,Russia has lost more money in one day as a result of the Ukraine crisis than it spent preparing for the Sochi Games,,Reddit,,social_media,2014
2014-03-13,Russian President Vladimir Putin's approval rating has soared to a three-year high following the political crisis in Ukraine and an upcoming regionwide referendum on whether Crimea should secede from Ukraine and return to Russia.,,Reddit,,social_media,2014
2014-03-14,"MH370 transmitted its location repeatedly to satellites over the course of five hours after it disappeared from radar, people briefed on the matter said, as searchers zeroed in on new target areas hundreds of miles west of the plane's original course.",,DJIA_Top11,0.0,financial,2014
2014-03-14,"Over 900 Workers Have Already Died Building Qatars World Cup Facilities - The 'International Trade Union Confederation' says that if conditions dont improve, at least 4,000 migrants will die before kick-off",,DJIA_Top24,0.0,financial,2014
2014-03-15,"World's first solar-powered toilet set for India launch - The toilet has the capability of heating human waste to a high enough temperature to sterilise it and create biochar, a highly porous charcoal",,Reddit,,social_media,2014
2014-03-15,"The Federal Deposit Insurance Corp sued 16 of the world's largest banks on Friday, accusing them of cheating dozens of other now defunct banks by manipulating the Libor interest rate. The global financial institutions broke certain swaps contracts they had entered into with the now-closed banks.",,Reddit,,social_media,2014
2014-03-16,Ukraine's president fears Russia could invade: Kremlin is behind turmoil in eastern Ukraine and there is 'real danger' Moscow could seize more territory,,Reddit,,social_media,2014
2014-03-16,Nigeria Navy destroys 260 illegal oil refineries,,Reddit,,social_media,2014
2014-03-17,U.S. Navy SEALs Take Control of Oil Tanker Hijacked in Libya,,DJIA_Top12,1.0,financial,2014
2014-03-17,Paris makes public transportation free due to smog crisis,,DJIA_Top21,1.0,financial,2014
2014-03-18,Voice of Russia announces that the chairman of the Transnistrian Parliament asked Russia to allow the breakaway Moldovan republic into the Russian Federation,,Reddit,,social_media,2014
2014-03-18,Putin announces that Russia will annex Crimea into the Russian Federation,,Reddit,,social_media,2014
2014-03-19,Israels defense minister (Moshe Yaalon) has signaled that his country has abandoned any hope that the United States will solve the Iranian nuclear crisis diplomatically and that he  in a reported reversal  would now support Israel taking unilateral military action against the Islamic Republic.,,DJIA_Top14,0.0,financial,2014
2014-03-19,"More Than 900 Workers Have Already Died Building Qatars World Cup Facilities | The International Trade Union Confederation says that if conditions dont improve, at least 4,000 migrants will die before kick-off",,DJIA_Top1,0.0,financial,2014
2014-03-20,"BP wins new US oil contracts four years after Deepwater Horizon disaster - wins 24 bids to begin exploration in the Gulf of Mexico, just days after authorities lifted a year-long ban",,DJIA_Top4,1.0,financial,2014
2014-03-20,"NASA: In 2012 Earth dodged a Solar blast by a mere nine days that would have taken out satellite communications systems, a big chunk of the GPS network, and possibly crashed power grids and computer systems down on the surface.",,Reddit,,social_media,2014
2014-03-21,Putin orders Russias central bank to help his billionaire friends after U.S. targets them for sanctions,,Reddit,,social_media,2014
2014-03-21,"The underlying message from the head of Russia's biggest oil company, Rosneft, was clear: If Europe and the United States isolate Russia, Moscow will look East for new business, energy deals, military contracts and political alliances.",,Reddit,,social_media,2014
2014-03-22,"Greece's economy has shrunk by nearly one-third since 2007, and the debt has become unmanageable. According to the Greek Census Bureau, there has been a 43 percent increase in suicides in austerity-chained Greece since the beginning of the crisis.",,Reddit,,social_media,2014
2014-03-22,"Ukraine finally signs the EU deal that started it all: Today's agreement between Brussels and Kiev is a version of the one Yanukovych originally rejected four months ago, precipitating the crisis with Russia.",,Reddit,,social_media,2014
2014-03-25,"Russia's Economy Ministry releases expected first quarter figures. GDP growth of ""around zero"", 7% inflation, capital flight of $65-70 billion. Mostly due to lost investor confidence, not sanctions.",,DJIA_Top17,1.0,financial,2014
2014-03-25,"Russia offers India crude oil supplies, stakes in blocks in the Barents Sea (Arctic Ocean)",,DJIA_Top20,1.0,financial,2014
2014-03-26,"Icelanders can now each claim $400 worth of Auroracoin, the country's new digital currency ""The goal is to decentralize power and revive Iceland's local economy, given that the kroner has fallen dramatically in value in recent years. Iceland was hard hit by the 2008 global financial crisis ...""",,DJIA_Top3,0.0,financial,2014
2014-03-26,"The head of Russia's largest bank, the state owned Sberbank, has warned that Russia is now at risk of recession",,DJIA_Top5,0.0,financial,2014
2014-03-27,G7 warns Russia of more sanctions if Ukraine crisis escalates,,Reddit,,social_media,2014
2014-04-01,Ukraine crisis: No sign of Russian troop pullout - Nato,,Reddit,,social_media,2014
2014-04-01,"Ocean Garbage Thwarts Flight 370 Search - ""The ocean is like a plastic soup, bulked up with the croutons of these larger items. It's like a toilet bowl that swirls but doesn't flush."" Australian PM pledges search will continue indefinitely, despite obstacles.",,Reddit,,social_media,2014
2014-04-01,"Unidentified drone crashed on South Korean border island, suspected to be of North Korean origin",,Reddit,,social_media,2014
2014-04-02,"Ukraine crisis: Poland asks Nato to station 10,000 troops on its territory",,Reddit,,social_media,2014
2014-04-02,Exxon Mobil says climate change unlikely to stop it selling fossil fuels: oil giant issues report on risks that climate policies could pose to the value of its assets and future profitability,,DJIA_Top7,1.0,financial,2014
2014-04-03,"Iran, Russia working to seal $20 bln oil-for-goods deal - sources",,DJIA_Top19,0.0,financial,2014
2014-04-05,"Declassified: Hours after a plane carrying the UN secretary general, Dag Hammarskjld, crashed over central Africa in September 1961, the US ambassador to Congo sent a cable to Washington claiming that the aircraft could have been shot down by a Belgian mercenary pilot.",,Reddit,,social_media,2014
2014-04-06,"Drone killings case thrown out in US - A US federal judge has dismissed a lawsuit filed against the government by the families of three American citizens killed by drones in Yemen, saying senior officials cannot be held personally responsible for money damages for the act of conducting war.",,Reddit,,social_media,2014
2014-04-06,The science spacecraft launched from Virginias coast last year has been orbiting the moon for months and is about to conclude its mission with a crash into the lunar surface.,,Reddit,,social_media,2014
2014-04-08,BBC News - Ukraine crisis: Violent brawl at Kiev parliament,,Reddit,,social_media,2014
2014-04-08,"Ukraine Turmoil Leaves Zoo Animals Starving  Over 6,000 in dire straits. 114-yr-old Nikolaev Zoo survived 2 world wars, but likely not this. Only enough left for carnivores to eat today &amp; tomorrow. Herbivores will last 1 more week. No medical supplies.",,DJIA_Top3,1.0,financial,2014
2014-04-09,"Italy has rescued 4,000 migrants from boats trying to reach European shores in the past 48 hours in a deepening immigration crisis",,Reddit,,social_media,2014
2014-04-10,"Russia claims NATO is concerned over an ""imaginary threat"" that Russia does not pose; the Russians counter-accused NATO of using the Ukraine crisis against Russia and also accused NATO of ""Cold War mentality.""",,Reddit,,social_media,2014
2014-04-10,"Last Minute Dash to Keep Big Oil from National Park  In 2007, for US$3.6 billion investment, Ecuador offered world chance to save 10% of all species on earth by keeping bio hot spot from oil. If enough signatures collected by April 12, voters can decide its fate instead of politicians.",,Reddit,,social_media,2014
2014-04-11,"Thai Tanker Sinks, Spilling Oily Sludge - It was carrying 40 times the volume of spilled sludge, headed to shore to deliver it to oil recycling facilities. While spill appears small, escaped oil has already fouled coastal fishing areas &amp; mangrove forests.",,Reddit,,social_media,2014
2014-04-12,Russian oil firm says Asian buyers willing to use euros,,Reddit,,social_media,2014
2014-04-13,"Eike Batista, who was Brazil's richest man for most of the past decade, is under investigation by securities industry watchdog CVM for allegedly engaging in insider trading while he chaired his now-bankrupt oil-producing and shipbuilding firms.",,Reddit,,social_media,2014
2014-04-13,Ukraine crisis: Kramatorsk shooting reported,,Reddit,,social_media,2014
2014-04-14,"Russia prepared to let tanks roll across borders - German minister: German Vice Chancellor Sigmar Gabriel warned on Monday of an escalation of the crisis in Ukraine, saying ""Russia was clearly prepared to allow tanks to roll across European borders"".",,Reddit,,social_media,2014
2014-04-15,"Russian economy may see zero growth this year because of the Ukraine crisis, Russia's finance minister has admitted",,Reddit,,social_media,2014
2014-04-15,"Russia on brink of financial crisis as showdown with West escalates - Country's private companies shut out of global bond markets, raising prospect that they may need state support.",,Reddit,,social_media,2014
2014-04-15,Chernobyl Sarcophagus Jeapordised by Crisis in Ukraine: The political crisis in Ukraine is severely hampering efforts to build a new radioactive containment structure over the site of the Chernobyl nuclear meltdown.,,Reddit,,social_media,2014
2014-04-15,Pro-Russian Ukrainian police help foil Ukraine crackdown in east,,Reddit,,social_media,2014
2014-04-16,Ukraine crisis: NATO to bolster forces in eastern Europe | World news,,Reddit,,social_media,2014
2014-04-17,"Russia Economy Worsens Even Before Sanctions Hit: With inflation rising, growth stagnating, the ruble and stock market plunging, and billions in capital fleeing the country for safety, the economy is teetering on the edge of recession, as the countrys minister of economic development acknowledged",,Reddit,,social_media,2014
2014-04-18,Canada sends six CF-18 jets to Poland in response to Ukraine crisis,,Reddit,,social_media,2014
2014-04-18,Ukraine crisis: US secretary of state Kerry announces Geneva agreement - live updates | 'Occupied' buildings to be vacated; arms turned over | Kiev would grant amnesty to protesters | Putin: 'Russia will find mutual understanding with Ukraine',,Reddit,,social_media,2014
2014-04-18,"Russian Foreign Minister Lavrov says all sides agree to steps to ""de-escalate"" Ukraine crisis, after talks in Geneva",,Reddit,,social_media,2014
2014-04-20,Ukraine crisis: Geneva deal hangs by a thread after deaths in Slavyansk Pro-Russian militants and unidentified assailants are reported killed in gun battle in eastern Ukrainian town,,Reddit,,social_media,2014
2014-04-20,"South Africans Have Case for Aiding Apartheid: Ford Motor Co. and IBM must face a class action from black South Africans accusing them of supplying the apartheid regime with military cars and computers, a federal judge ruled.",,Reddit,,social_media,2014
2014-04-20,"Some 3,000 Crimeans refuse to become Russian citizens: About 3,000 residents of Crimea, including Sevastopol, have refused to receive Russian passports, Russian Federal Migration Service chief Konstantin Romodanovsky said.",,Reddit,,social_media,2014
2014-04-20,"Nearly 1/5 of China's farmland is now too polluted to farm; 82.8 percent of contaminated lands are polluted by pollutants like Arsenic, Cadmium, and Nickel. ""Although air pollution is highly visible and present, these pollutants eventually end up in the soil and pollute it as well.""",,Reddit,,social_media,2014
2014-04-20,"In 60 Days, South Sudan will Starve: There is a looming crisis in South Sudan that, if not dealt with, could rival some of the worst famines in recent history.",,Reddit,,social_media,2014
2014-04-21,Russia stares at recession as Ukraine crisis scars economy,,DJIA_Top14,1.0,financial,2014
2014-04-21,Ukraine Conflict Becomes Hostage Crisis as Separatists Take Prisoners,,Reddit,,social_media,2014
2014-04-22,Hundreds of people were killed because of their ethnicity after South Sudan rebels seized the oil hub of Bentiu last week,,DJIA_Top21,1.0,financial,2014
2014-04-22,"China's new environment law submitted to parliament... will give legal backing to Beijing's newly declared war on pollution and formalise a pledge made last year to abandon a decades-old growth-at-all-costs economic model that has spoiled much of China's water, skies and soil.",,DJIA_Top6,1.0,financial,2014
2014-04-23,Russia begins extracting oil in the Arctic despite Greenpeace efforts,,Reddit,,social_media,2014
2014-04-24,"Russia, India Planning $30 Billion Oil Pipeline Through Xinjiang",,DJIA_Top25,0.0,financial,2014
2014-04-24,Ukraine crisis: Army moves to retake Sloviansk,,DJIA_Top11,0.0,financial,2014
2014-04-26,US troops land in Latvia amid Ukraine crisis,,Reddit,,social_media,2014
2014-04-26,Ukraine crisis: Pentagon says Russian jets violated airspace,,Reddit,,social_media,2014
2014-04-27,Russian and Ukrainian game developers are starting to leave their countries in midst of political crisis,,Reddit,,social_media,2014
2014-04-27,A federal judge on Wednesday dismissed criminal charges against a former Blackwater security guard whose actions allegedly triggered the shootings of dozens of Iraqi citizens at a traffic circle in Baghdad nearly seven years ago,,Reddit,,social_media,2014
2014-04-28,BP and Shell exposed as US prepares first warning shot against Russia's oil and gas industry,,DJIA_Top7,1.0,financial,2014
2014-04-28,Ukraine crisis: EU set to intensify Russia sanctions,,Reddit,,social_media,2014
2014-04-30,"Hess and Mercuria Added to Crude Oil Price-Fixing Suit; joining BP, Shell, and Statoil in alleged conspiracy [Bloomberg]",,DJIA_Top22,1.0,financial,2014
2014-05-02,"US troops head to Latvia as Ukraine crisis continues, us troops to train with live fire and 50 lbs of gear.",,Reddit,,social_media,2014
2014-05-03,G7 to discuss weaning Europe off Russian oil amid Ukraine crisis,,Reddit,,social_media,2014
2014-05-03,Russia blames the West for crisis in Ukraine,,Reddit,,social_media,2014
2014-05-04,"Ukraine crisis: we are now at war with pro-Russia rebels, states Kiev",,Reddit,,social_media,2014
2014-05-05,Indonesian Villagers Driven from Villages in Palm Oil Land Theft,,Reddit,,social_media,2014
2014-05-06,"Dennis Rodman: Kim didn't kill his uncle or his ex. ""The last time I went there, when they said they killed his girlfriend, they killed his uncle, they just fed him to the dogs ... They were standing right behind me.""",,Reddit,,social_media,2014
2014-05-07,Europe softens stance on Canadas oil sands as relations with Russia sour,,Reddit,,social_media,2014
2014-05-07,"NATO troops in East Europe could be permanent after Crimea crisis: NATO will have to consider permanently stationing troops in parts of Eastern Europe in response to the crisis in Ukraine and Russias annexation of Crimea, the organisations top military commander said Tuesday.",,Reddit,,social_media,2014
2014-05-10,Europe softens stance on Canadas oil sands as relations with Russia sour,,Reddit,,social_media,2014
2014-05-11,Russia Claims Ukraines Black Sea Oil And Gas Bounty,,Reddit,,social_media,2014
2014-05-12,Obama aims oil weapon at Putin but will he pull the trigger? Oil prices heading for major correction after Russia's attempt to use crude as a weapon to bully Western powers backfires,,Reddit,,social_media,2014
2014-05-12,Ukraine crisis: National guardsmen fire into crowd - World,,Reddit,,social_media,2014
2014-05-13,"A Future Of Thirst: Water Crisis Lies On The Horizon -- ""The next time your throat is as dry as a bone and the Sun is beating down, take a glass of clean, cool water. Savour it. Sip by sip. Vital and appreciated as that water is, it will be even more precious to those who will follow you.""",,Reddit,,social_media,2014
2014-05-13,"United Nations: ""It is difficult to reconcile Canadas well-developed legal framework and general prosperity with the human rights problems faced by indigenous peoples in Canada that have reached crisis proportions in many respects.""",,Reddit,,social_media,2014
2014-05-14,"WWF staff receive death threats for opposing Virunga oil exploitation | ""The callers  said that they had missed killing de Merode, but would not miss WWF's employee,""",,DJIA_Top14,0.0,financial,2014
2014-05-15,Alberta government is planning to sell off crucial caribou habitat to the energy industry just days after a federal scientific panel said the herds were in immediate danger of vanishing completely,,Reddit,,social_media,2014
2014-05-16,Australia: Flaming Ball Falls from Sky and Crashes 'Like a Bomb',,Reddit,,social_media,2014
2014-05-16,Russian Proton rocket carrying advanced satellite crashes,,Reddit,,social_media,2014
2014-05-16,"UK's oil, coal and gas 'gone in five years'. In just over five years Britain will have run out of oil, coal and gas, researchers have warned.",,Reddit,,social_media,2014
2014-05-17,"Laos military plane has crashed - 20 on board, 3 confirmed dead including the minister of public security, the minister of defense, and the governor of Vientiane province.",,Reddit,,social_media,2014
