fecha,titulo,descripcion,fuente,label_dia,categoria,año
2010-04-29,"Spain downgraded, Europe debt crisis widens",,DJIA_Top11,1.0,financial,2010
2010-04-29,b'Israeli Soldier Sprays Pepper Spray Directly Into The Eyes Of Handcuffed Palestinean Youth (PIC) ',,Reddit,,social_media,2010
2010-04-29,"b'Many observers assign a large part of the blame for the 2008 financial crisis to the ""big three"" credit rating agencies, which gave their AAA seal of approval to worthless investments. Now those same agencies are helping to bring the euro zone to its knees -- and no one is trying to stop them'",,Reddit,,social_media,2010
2010-04-29,"b'Spain downgraded, Europe debt crisis widens'",,Reddit,,social_media,2010
2010-04-30,b'Brazilian street vendors are hawking a video of an elderly priest molesting an altar boy. Dom Phillips reports from Brazil on the popes brewing crisis in South America.',,Reddit,,social_media,2010
2010-04-30,Brazilian street vendors are hawking a video of an elderly priest molesting an altar boy. Dom Phillips reports from Brazil on the popes brewing crisis in South America.,,DJIA_Top14,0.0,financial,2010
2010-05-01,"b'A catastrophe looms on Louisianas coast  --  \nAs the oil begins to wash ashore, David Usborne reports from a community powerless to save itself'",,Reddit,,social_media,2010
2010-05-01,"b""Spanish Unemployment Tops 20%, Hurting Deficit Fight  - Spain's economic crisis is far more important to the EU than Greece. In addition to massive unemployment and a stagnant economy, one of Spain's biggest problems at the moment is ability to rollover 225 billion of euro denominated debt.""",,Reddit,,social_media,2010
2010-05-02,"b'Brazil and Norway, two other major oil-producing nations require an acoustic switch on their wells as last-resort protection against underwater spills. The U.S. considered requiring a remote-controlled shut-off mechanism several years ago but guess what...'",,Reddit,,social_media,2010
2010-05-02,"b""BA caught short as all airliner's toilets fail""",,Reddit,,social_media,2010
2010-05-02,"b'15,000 kids skip school to protest oil pollution in Kuwait'",,Reddit,,social_media,2010
2010-05-03,Deepwater Horizon oil spill: turtle deaths soar amid fight to save wildlife (The picture accompanying this article makes me so sad...),,DJIA_Top10,1.0,financial,2010
2010-05-03,Iran offers help in fighting Gulf of Mexico oil leak,,DJIA_Top3,1.0,financial,2010
2010-05-03,b'Iran offers help in fighting Gulf of Mexico oil leak',,Reddit,,social_media,2010
2010-05-03,b'Deepwater Horizon oil spill: turtle deaths soar amid fight to save wildlife (The picture accompanying this article makes me so sad...)',,Reddit,,social_media,2010
2010-05-04,"b""It looks like BP will be on the hook for the Deepwater Horizon oil spill.  Great.  That's progress.  Now lets get the Wall Street firms that engineered the financial crisis to pay for the mess they created too.""",,Reddit,,social_media,2010
2010-05-04,"b""Greece's swollen bureaucracy is taking the hardest hits as the country struggles to fix its failing economy. Civil servants are responding with massive strikes. But critics say the country's public sector is inefficient, expensive and hopelessly overstaffed.""",,Reddit,,social_media,2010
2010-05-04,b'Iran offers to help contain US oil spill',,Reddit,,social_media,2010
2010-05-04,"b""When the Soviets had leaking oil wells they couldn't seal, they nuked them""",,Reddit,,social_media,2010
2010-05-04,Iran offers to help contain US oil spill,,DJIA_Top2,0.0,financial,2010
2010-05-04,"When the Soviets had leaking oil wells they couldn't seal, they nuked them",,DJIA_Top1,0.0,financial,2010
2010-05-04,It looks like BP will be on the hook for the Deepwater Horizon oil spill.  Great.  That's progress.  Now lets get the Wall Street firms that engineered the financial crisis to pay for the mess they created too.,,DJIA_Top17,0.0,financial,2010
2010-05-04,"Greece's swollen bureaucracy is taking the hardest hits as the country struggles to fix its failing economy. Civil servants are responding with massive strikes. But critics say the country's public sector is inefficient, expensive and hopelessly overstaffed.",,DJIA_Top15,0.0,financial,2010
2010-05-05,"b""Greeks Struggle with Sick-Man Status - They've emptied their bank accounts, abandoned vacations and started taking the bus. Now, they fear for their jobs: The Greeks bemoan the difficult crisis that has taken over their country. Above all, they feel humiliated by Germany.""",,Reddit,,social_media,2010
2010-05-05,"b'What do the oil slick in the Gulf of Mexico and the Greek crisis have in common? Both are man-made disasters. But while BP plans to shoulder the costs of the catastrophe it has caused, the financial wizards behind the euro crisis are not being held to account.'",,Reddit,,social_media,2010
2010-05-05,"b'Greece riots: 100,000 fight against harsh cuts in Athens financial crisis protests '",,Reddit,,social_media,2010
2010-05-05,"Greece riots: 100,000 fight against harsh cuts in Athens financial crisis protests ",,DJIA_Top20,0.0,financial,2010
2010-05-05,"What do the oil slick in the Gulf of Mexico and the Greek crisis have in common? Both are man-made disasters. But while BP plans to shoulder the costs of the catastrophe it has caused, the financial wizards behind the euro crisis are not being held to account.",,DJIA_Top14,0.0,financial,2010
2010-05-05,"Greeks Struggle with Sick-Man Status - They've emptied their bank accounts, abandoned vacations and started taking the bus. Now, they fear for their jobs: The Greeks bemoan the difficult crisis that has taken over their country. Above all, they feel humiliated by Germany.",,DJIA_Top1,0.0,financial,2010
2010-05-06,The French navy has closed in on the black boxes of an Air France jet that crashed in the Atlantic nearly a year ago raising hope that light will be shed on the disaster that left 228 dead.,,DJIA_Top25,0.0,financial,2010
2010-05-06,"b'Russian special forces storm oil tanker, free ship'",,Reddit,,social_media,2010
2010-05-06,b'The Italian island ofunemployment',,Reddit,,social_media,2010
2010-05-06,b'The French navy has closed in on the black boxes of an Air France jet that crashed in the Atlantic nearly a year ago raising hope that light will be shed on the disaster that left 228 dead.',,Reddit,,social_media,2010
2010-05-06,The Italian island ofunemployment,,DJIA_Top16,0.0,financial,2010
2010-05-06,"Russian special forces storm oil tanker, free ship",,DJIA_Top2,0.0,financial,2010
2010-05-07,"b'Thought you should know... 3,235,000 gallons of oil have spilled into the Gulf of Mexico so far.'",,Reddit,,social_media,2010
2010-05-07,b'Argentina denounces British pirates after oil discovery in Falklands waters',,Reddit,,social_media,2010
2010-05-07,b'Gulf of Mexico oil slick: Sarah Palin fuels anti-British sentiment',,Reddit,,social_media,2010
2010-05-07,"b'Oil Struck near Falklands Islands, UK Defense Minister Claims ""Legitimate right"" to the oil'",,Reddit,,social_media,2010
2010-05-07,Gulf of Mexico oil slick: Sarah Palin fuels anti-British sentiment,,DJIA_Top22,0.0,financial,2010
2010-05-07,"Oil Struck near Falklands Islands, UK Defense Minister Claims ""Legitimate right"" to the oil",,DJIA_Top14,0.0,financial,2010
2010-05-07,Argentina denounces British pirates after oil discovery in Falklands waters,,DJIA_Top13,0.0,financial,2010
2010-05-07,"Thought you should know... 3,235,000 gallons of oil have spilled into the Gulf of Mexico so far.",,DJIA_Top2,0.0,financial,2010
2010-05-08,b'Greece: The opposition (Nea Dimokratia - the party largely responsible for the current economic crisis) expel one of the few decent politicians in Greece for voting in favour of the PASOK austerity measures. Partisanship in Greece is worst than in the USA. ',,Reddit,,social_media,2010
2010-05-10,"b'In Belgium, there are no national political parties, no national newspaper, no national TV channel, no common school curriculum or higher education, and no national football team. There is, however, the national debt, running at 80% of GDP.'",,Reddit,,social_media,2010
2010-05-10,b'Ordinary Greeks angry at government and rioters: But youth see debt crisis as evidence that the capitalist system is broken.',,Reddit,,social_media,2010
2010-05-10,"b""What's In a Name?  When it comes to oil spills, apparently its a lot. [WashPost]""",,Reddit,,social_media,2010
2010-05-10,"In Belgium, there are no national political parties, no national newspaper, no national TV channel, no common school curriculum or higher education, and no national football team. There is, however, the national debt, running at 80% of GDP.",,DJIA_Top3,1.0,financial,2010
2010-05-10,Ordinary Greeks angry at government and rioters: But youth see debt crisis as evidence that the capitalist system is broken.,,DJIA_Top11,1.0,financial,2010
2010-05-10,"What's In a Name?  When it comes to oil spills, apparently its a lot. [WashPost]",,DJIA_Top24,1.0,financial,2010
2010-05-11,b'Amateur Video Of Gulf Oil Slick - Damage Appears To Be Much Worse Than BP Admits',,Reddit,,social_media,2010
2010-05-11,Amateur Video Of Gulf Oil Slick - Damage Appears To Be Much Worse Than BP Admits,,DJIA_Top15,0.0,financial,2010
2010-05-12,"b'BP throws kitchen sink at oil Geyser. Plans to dump ""junk"" in the well; Tires, balls, and other crap.'",,Reddit,,social_media,2010
2010-05-12,b'Lone survivor in plane crash this morning (BBC)',,Reddit,,social_media,2010
2010-05-12,"BP throws kitchen sink at oil Geyser. Plans to dump ""junk"" in the well; Tires, balls, and other crap.",,DJIA_Top24,1.0,financial,2010
2010-05-12,Lone survivor in plane crash this morning (BBC),,DJIA_Top22,1.0,financial,2010
2010-05-13,Gulf oil spill: firms ignored warning signs before blast.,,DJIA_Top13,0.0,financial,2010
2010-05-13,"Portugal unveils crisis tax to cut deficit - Jos Scrates, Portugals prime minister, on Thursday announced tough new austerity measures, including a crisis tax on wages and big companies, designed to more than halve the countrys gaping budget deficit in less than two years.",,DJIA_Top21,0.0,financial,2010
2010-05-13,b'Gulf oil spill: firms ignored warning signs before blast.',,Reddit,,social_media,2010
2010-05-13,"b'Portugal unveils crisis tax to cut deficit - Jos Scrates, Portugals prime minister, on Thursday announced tough new austerity measures, including a crisis tax on wages and big companies, designed to more than halve the countrys gaping budget deficit in less than two years.'",,Reddit,,social_media,2010
2010-05-14,"Thai troops fire on redshirts as crisis escalates. One protester shot dead as thousands join Bangkok standoff, Photographer and journalist also shot in night of violence",,DJIA_Top4,0.0,financial,2010
2010-05-14,Regulators at the Minerals Management Service exempted 27 offshore drilling projects in the Gulf of Mexico from in-depth environmental analysisafter the Deepwater Horizon oil rig exploded. One of the exemptions went to BP. Deepwater Horizon had been exempted. ,,DJIA_Top13,0.0,financial,2010
2010-05-14,Greek Economic Crisis: Turkish PM and delegation in Greece to discuss disarmament. Unprecedented talks on ceasing centuries of hostility. ,,DJIA_Top18,0.0,financial,2010
2010-05-14,"b'Thai troops fire on redshirts as crisis escalates. One protester shot dead as thousands join Bangkok standoff, Photographer and journalist also shot in night of violence'",,Reddit,,social_media,2010
2010-05-14,b'Greek Economic Crisis: Turkish PM and delegation in Greece to discuss disarmament. Unprecedented talks on ceasing centuries of hostility. ',,Reddit,,social_media,2010
2010-05-14,b'Regulators at the Minerals Management Service exempted 27 offshore drilling projects in the Gulf of Mexico from in-depth environmental analysisafter the Deepwater Horizon oil rig exploded. One of the exemptions went to BP. Deepwater Horizon had been exempted. ',,Reddit,,social_media,2010
2010-05-15,"b'Turkish article on Greek crisis: ""The core problem (in Greece) seems to be the delusion that most socialists seem to believe: that governments have unlimited wealth, and the only matter is how hard can you press them to distribute it?""'",,Reddit,,social_media,2010
2010-05-15,"b""Remember that plane crash that killed off the Polish government? Russia refuses to turn over the Polish jet's black boxes. """,,Reddit,,social_media,2010
2010-05-15,b'Racial tensions mount in Greece: Greek economic crisis accelerates clashes between immigrants and locals.',,Reddit,,social_media,2010
2010-05-15,"b'Don\'t worry about that pesky oil spill in the Gulf of Mexico, it\'s ""relatively tiny"" - Tony Hayward, BP CEO'",,Reddit,,social_media,2010
2010-05-16,"b'""Once were all finally distracted from the possibility of the Gulf of Mexico being turned into a dead sea by the next 24/7 crisis - expect repeats. After all, what happens when, in the tough oil era, the BPs of this world hit the melting Arctic with their deep water rigs in really bad climates?""'",,Reddit,,social_media,2010
2010-05-17,BP's Oil Spill is Latest Crime in a History of Plunder,,DJIA_Top12,1.0,financial,2010
2010-05-17,"b""BP's Oil Spill is Latest Crime in a History of Plunder""",,Reddit,,social_media,2010
2010-05-19,"b""Germany bans naked short selling and the trading of naked credit default swaps involving euro zone debt. The bans target two types of speculative trading that have been blamed for exacerbating the financial crisis and Europe's sovereign debt crisis.""",,Reddit,,social_media,2010
2010-05-19,"b"" Non-crew in cockpit in Polish president's plane crash""",,Reddit,,social_media,2010
2010-05-19,"b'Experts feared that it would happen -- and now it has. The devastating oil spill in the Gulf of Mexico has come in contact with a strong ocean current. As a result, the oil could end up further afield, with unforeseen and potentially devastating consequences.[+gallery]'",,Reddit,,social_media,2010
2010-05-19,"Experts feared that it would happen -- and now it has. The devastating oil spill in the Gulf of Mexico has come in contact with a strong ocean current. As a result, the oil could end up further afield, with unforeseen and potentially devastating consequences.[+gallery]",,DJIA_Top9,0.0,financial,2010
2010-05-19, Non-crew in cockpit in Polish president's plane crash,,DJIA_Top6,0.0,financial,2010
2010-05-19,Germany bans naked short selling and the trading of naked credit default swaps involving euro zone debt. The bans target two types of speculative trading that have been blamed for exacerbating the financial crisis and Europe's sovereign debt crisis.,,DJIA_Top5,0.0,financial,2010
2010-05-20,"b""A Thai Writer's Response to the Western Media's Inaccurate Portrayal of the Thai Crisis""",,Reddit,,social_media,2010
2010-05-20,A Thai Writer's Response to the Western Media's Inaccurate Portrayal of the Thai Crisis,,DJIA_Top17,0.0,financial,2010
2010-05-21,7 big oil accidents waiting to happen,,DJIA_Top8,1.0,financial,2010
2010-05-21,Russian politics have gotten so weird that now the Kremlin is executing raids against the Russian chess federation to install the right chess master at its head,,DJIA_Top14,1.0,financial,2010
2010-05-21,b'Russian politics have gotten so weird that now the Kremlin is executing raids against the Russian chess federation to install the right chess master at its head',,Reddit,,social_media,2010
2010-05-21,b'7 big oil accidents waiting to happen',,Reddit,,social_media,2010
2010-05-22,"b'Six survivors in the horrific plane crash in Mangalore, India'",,Reddit,,social_media,2010
2010-05-22,b'EU staff demand more money in the midst of debt crisis',,Reddit,,social_media,2010
2010-05-22,b'160+ dead in Air India crash',,Reddit,,social_media,2010
2010-05-24,The Federal Government is expelling an Israeli diplomat after it found Israel faked Australian passports which were used in a hit on a top Hamas commander in Dubai.,,DJIA_Top9,0.0,financial,2010
2010-05-24,Norwegian press gives the real story about what's happening with the gulf oil cleanup... We really aren't getting the whole story here.  (Use Chrome or Google page translation),,DJIA_Top12,0.0,financial,2010
2010-05-24,BP calls in Kevin Costner's $26m vacuum cleaners to mop up huge oil spill,,DJIA_Top10,0.0,financial,2010
2010-05-24,"b""Norwegian press gives the real story about what's happening with the gulf oil cleanup... We really aren't getting the whole story here.  (Use Chrome or Google page translation)""",,Reddit,,social_media,2010
2010-05-24,"b""BP calls in Kevin Costner's $26m vacuum cleaners to mop up huge oil spill""",,Reddit,,social_media,2010
2010-05-24,b'The Federal Government is expelling an Israeli diplomat after it found Israel faked Australian passports which were used in a hit on a top Hamas commander in Dubai.',,Reddit,,social_media,2010
2010-05-25,Fears grow that banks could send euro crisis global,,DJIA_Top17,0.0,financial,2010
2010-05-25,Journalism and 'the words of power'... how we are spoon fed thoughts and opinions without realising it,,DJIA_Top2,0.0,financial,2010
2010-05-25,"b""Journalism and 'the words of power'... how we are spoon fed thoughts and opinions without realising it""",,Reddit,,social_media,2010
2010-05-25,b'Fears grow that banks could send euro crisis global',,Reddit,,social_media,2010
2010-05-26,"The Corporate Stranglehold: How BP Will Make out Like Bandits from Its Massive, Still Gushing Oil Disaster-The existing $75 million cap on damages for offshore drilling companies is a bailout every bit as disgusting as those recently bestowed upon Wall Street",,DJIA_Top9,0.0,financial,2010
2010-05-26,"b'The Corporate Stranglehold: How BP Will Make out Like Bandits from Its Massive, Still Gushing Oil Disaster-The existing $75 million cap on damages for offshore drilling companies is a bailout every bit as disgusting as those recently bestowed upon Wall Street'",,Reddit,,social_media,2010
2010-05-26,"A Yemeni airstrike targeting al Qaeda missed its mark today and killed a mediator by mistake, prompting members of his tribe to blow up a crude oil pipeline in clashes that followed",,DJIA_Top22,0.0,financial,2010
2010-05-26,"b'A Yemeni airstrike targeting al Qaeda missed its mark today and killed a mediator by mistake, prompting members of his tribe to blow up a crude oil pipeline in clashes that followed'",,Reddit,,social_media,2010
2010-05-27,"BP oil well ""top kill"" bid continues, no update yet. IN RESPONSE of Los Angeles Times report that had quoted a Coast Guard admiral saying the oil spill  top kill procedure had succeeded in blocking the leak",,DJIA_Top18,1.0,financial,2010
2010-05-27,"b'BP oil well ""top kill"" bid continues, no update yet. IN RESPONSE of Los Angeles Times report that had quoted a Coast Guard admiral saying the oil spill  top kill procedure had succeeded in blocking the leak'",,Reddit,,social_media,2010
2010-05-28,"Israeli FM Lieberman: Gaza aid convoy ""is violent propaganda against Israel. There is no humanitarian crisis in the Gaza Strip. We respond in the most humane way possible",,DJIA_Top14,0.0,financial,2010
2010-05-28,Oil leak shown on Spillcam is not the only leak.  Some now allege that there is a much larger leak BP isn't showing us. [vid],,DJIA_Top6,0.0,financial,2010
2010-05-28,China joins talks on Korea crisis,,DJIA_Top22,0.0,financial,2010
2010-05-28,"b""Oil leak shown on Spillcam is not the only leak.  Some now allege that there is a much larger leak BP isn't showing us. [vid]""",,Reddit,,social_media,2010
2010-05-28,"b'Israeli FM Lieberman: Gaza aid convoy ""is violent propaganda against Israel. There is no humanitarian crisis in the Gaza Strip. We respond in the most humane way possible'",,Reddit,,social_media,2010
2010-05-28,b'China joins talks on Korea crisis',,Reddit,,social_media,2010
2010-05-30,"b'Nigerian oil spills? I am saddened by the ""Meh.""'",,Reddit,,social_media,2010
2010-05-30,b'Shell Oil tried for crimes against humanity',,Reddit,,social_media,2010
2010-05-31,"b""Nigeria's Agony Dwarfs the Gulf Oil Spill. The US and Europe Ignore It""",,Reddit,,social_media,2010
2010-05-31,"b'Former German Foreign Minister: ""How many bailouts will the people of the Western democracies tolerate before the crisis of the global financial system turns into a crisis of Western democracy? The answer is clear: not many more.""'",,Reddit,,social_media,2010
2010-06-01,Presenting a Dutch proposal to stop the oil within days,,DJIA_Top18,0.0,financial,2010
2010-06-01,b'Presenting a Dutch proposal to stop the oil within days',,Reddit,,social_media,2010
2010-06-02,"b""Why is Gaza under blockade? What's the impact? Israel says there is no humanitarian crisis in the Gaza Strip, UN strongly disagrees.""",,Reddit,,social_media,2010
2010-06-02,"Why is Gaza under blockade? What's the impact? Israel says there is no humanitarian crisis in the Gaza Strip, UN strongly disagrees.",,DJIA_Top20,1.0,financial,2010
2010-06-03,BP pays out. (To whom? Oil pollution victims? Noooo...),,DJIA_Top13,1.0,financial,2010
2010-06-03,b'BP pays out. (To whom? Oil pollution victims? Noooo...)',,Reddit,,social_media,2010
2010-06-04,"b'Six Giant Banks Made $51bil last year; The other 980 Lost Money; the proprietary trading operations of an oligopoly of banks, saved from disaster by Uncle Sam and subsidized with cheap money from the central bank, was the single driving force behind the renewed surge in their stock.'",,Reddit,,social_media,2010
2010-06-04,"b'Apartment block with metal grilles on its windows and no fire escape is engulfed by fire in Bangladesh, more than 100 dead'",,Reddit,,social_media,2010
2010-06-04,"Apartment block with metal grilles on its windows and no fire escape is engulfed by fire in Bangladesh, more than 100 dead",,DJIA_Top25,0.0,financial,2010
2010-06-04,"Six Giant Banks Made $51bil last year; The other 980 Lost Money; the proprietary trading operations of an oligopoly of banks, saved from disaster by Uncle Sam and subsidized with cheap money from the central bank, was the single driving force behind the renewed surge in their stock.",,DJIA_Top8,0.0,financial,2010
2010-06-06,b'Russia proposes global fund to insure against large-scale environmental disasters like the Gulf of Mexico oil spill',,Reddit,,social_media,2010
2010-06-07,b'GDP vs National debt  by country',,Reddit,,social_media,2010
2010-06-07,GDP vs National debt  by country,,DJIA_Top22,0.0,financial,2010
2010-06-08,Russian Soldiers 'looted Polish crash dead' - \r\nFour Russian soldiers have been charged with stealing bank cards from the wreckage of the plane crash that killed Polish President Lech Kaczynski and 95 others.,,DJIA_Top5,1.0,financial,2010
2010-06-08,b'Shell has been spilling oil in Nigeria for years with impunity',,Reddit,,social_media,2010
2010-06-08,"b""Russian Soldiers 'looted Polish crash dead' - \r\nFour Russian soldiers have been charged with stealing bank cards from the wreckage of the plane crash that killed Polish President Lech Kaczynski and 95 others.""",,Reddit,,social_media,2010
2010-06-08,b'International Subsidies for Oil Equal $557 BILLION; [Cutting Subsidies] This is the only single policy item that could make such a major change in the global energy and climate-change game. ',,Reddit,,social_media,2010
2010-06-08,Shell has been spilling oil in Nigeria for years with impunity,,DJIA_Top15,1.0,financial,2010
2010-06-08,International Subsidies for Oil Equal $557 BILLION; [Cutting Subsidies] This is the only single policy item that could make such a major change in the global energy and climate-change game. ,,DJIA_Top19,1.0,financial,2010
2010-06-08,"Spanish Youth Part of the Lost Generation - At almost 20 percent, Spain suffers the second-highest unemployment rate in the European Union. But the rate for those just entering the job market is twice as high.",,DJIA_Top24,1.0,financial,2010
2010-06-08,"b'Spanish Youth Part of the Lost Generation - At almost 20 percent, Spain suffers the second-highest unemployment rate in the European Union. But the rate for those just entering the job market is twice as high.'",,Reddit,,social_media,2010
2010-06-09,b'Moving the Markets - Europe Looks to Break US Ratings Monopoly: Few doubt that US ratings agencies contributed greatly to the global financial crisis. Europe is exploring the possibility of creating its own ratings agency.',,Reddit,,social_media,2010
2010-06-09,"b'Oil Consortium Behind War Crimes in Sudan: ""First aerial bombardment, then ground troops killed the remaining population and set villages on fire. Finally they declared the area safe and the oil companies came in"" '",,Reddit,,social_media,2010
2010-06-09,Moving the Markets - Europe Looks to Break US Ratings Monopoly: Few doubt that US ratings agencies contributed greatly to the global financial crisis. Europe is exploring the possibility of creating its own ratings agency.,,DJIA_Top16,0.0,financial,2010
2010-06-09,"Oil Consortium Behind War Crimes in Sudan: ""First aerial bombardment, then ground troops killed the remaining population and set villages on fire. Finally they declared the area safe and the oil companies came in"" ",,DJIA_Top8,0.0,financial,2010
2010-06-10,b'Dutch offered US ships to help skim oil 3 days after the spill. US was not interested',,Reddit,,social_media,2010
2010-06-10,Dutch offered US ships to help skim oil 3 days after the spill. US was not interested,,DJIA_Top3,1.0,financial,2010
2010-06-11,b'Looks like we might have to worry more about the effect of Corexit 9500 then the effect of oil on our environment.',,Reddit,,social_media,2010
2010-06-11,Looks like we might have to worry more about the effect of Corexit 9500 then the effect of oil on our environment.,,DJIA_Top14,1.0,financial,2010
2010-06-13,"b'""When we found this dolphin it was filled with oil. Oil was just pouring out of it. It was the saddest darn thing to look at,"" said a BP contract worker who took the Daily News on a surreptitious tour of the wildlife disaster unfolding in Louisiana.'",,Reddit,,social_media,2010
